neutral;trailer arrow year sdcc 
negative;yep hes definit sdcc biggest stage pimp shit show 
neutral;cant wait hear wtf jatan say sdcc perfect venu add bait lower dd con 
neutral;see thing ask sdcc 
neutral;schneider ngoma sdcc releas soon dont miss one 
neutral;ask tvd press sdcc sterolin ride stefan motorbik next season thank 
neutral;could ask sdcc tvd press stefan dress santa claus carolin twin thank 
neutral;could ask sterolin ever snow kiss interview tvd cast crew sdcc thank 
neutral;could ask tvd cast juli sterolin june wed sdcc 
neutral;flash wbsdcc sdcc 
neutral;hi cover tvd press sdcc could ask sterolin june wed propos cabin possibl 
neutral;hi cover tvd sdcc could ask well see stefan take carolin fall someday thank 
neutral;hi pleas ask paul candicejuli sdcc sterolin scene come first episod tvd 
negative;feel ya get sleep next week butit worth sdcc 
neutral;cover tvd press sdcc ask well ever see sterolin watch notebook friend pleas haha 
neutral;im tri find littl info deadpool bluray sdcc most price special restrict line 
neutral;lmao meeeeeeee final get ass unpack caus pack go sd comic con rli sdcc 
positive;martin get inspir jane charact choos jaimi rolesdcc blindspot 
neutral;sdcc 
neutral;pleas ask sterolinejunewed sdcc interview tvd cast crew 
neutral;readi sdcc cant wait see 
neutral;sdcc shirt think although may requir preorder investig 
positive;sdcc tmnt brilliant yes pleas kid would love rted 
neutral;joker might say someth 
neutral;sdcc whole new world duh 
positive;excit dctv 
neutral;well pleas amend initi tweet track timestamp endur sdcc talk resurfac 
neutral;day gon na sdcc 
neutral;wish go sdcc could hang 
positive;news e anteprim toynami stealth voltron ex sdcc 
neutral;promobrick sdcc ray palmer alia atom lego minifigur vorgestellt brickrss lego 
positive;ad littl detail axe earlier today take hour nap back work sdcc one day 
neutral;almost flight time sdcc come 
neutral;journey begin sdcc current manchest airport 
positive;andrea roth entertain week sdcc celebr andrearoth 
neutral;anoth year anoth sdcc cant attend 
neutral;airport head sdcc im readi sdcc 
negative;bitch 
neutral;board plane way la sdcc 
neutral;bruh 
neutral;power grayskul childhoodnostalgia heman 
neutral;calm storm sdcc sandiego 
neutral;cant believ ill miss year sdcc 
negative;complimentari second bag check win especi probabl overweight overs fli sdcc 
negative;couldnt sleep shit insomnia excit got plan budget im sure wont happen sdcc sdcc 
neutral;dc comic lil bombshel cryptozo sale sdcc 
neutral;erin richard gotham press line sdcc erinrichard 
neutral;exclus captainamerica first aveng amp antman poster sdcc week 
negative;final board first flight sdcc btw mention hate fli deep breath itll ok 
neutral;futurama robot santa bender action figur two pack comic con sdcc futurama 
positive;geofdarrow x threea ltd edit poster avail sdcc booth detail 
positive;gorgeous 
neutral;harleyquinn invad sdcc cgc ss blue rrp sketch variant lot sign 
neutral;heman master univers philip tan sign sdcc sketch variant motu 
negative;hey ha 
neutral;hey mike need look get sdcc amp say hi mr 
neutral;hey year im go sdcc tabl ill sign marvel booth thursday pm whos come 
negative;claim 
neutral;enter win sdcc prize pack 
neutral;hate let sdcc get im hope camp use go longer say cant allow girl join boy trip 
negative;clue im wear sdcc halp 
neutral;icymi green arrow flash amp supergirl appear conan sdcc 
neutral;icymi icymi green arrow flash amp supergirl appear conan sdcc 
neutral;think im go watch batman movi order prepar sdcc your fool 
neutral;im sdcc life great saw justic leagu panel entir cast finish zack snyder walk mic amp say 
neutral;im excit attend mtv teen wolf comiccon come sdcc 
negative;im readi 
positive;intermedi group spin tonight sdcc usual approx km steadi pace welcom 
negative;join us sdcc week number special event special guest tsutomu nihei creator blame 
positive;juli comic con sdcc th year press 
neutral;leg one journey sdcc begin got pick car take airport 
neutral;lego sdcc dc comic ray palmer atom minifigur exclus confirmend minifig price guid lego 
positive;let friend sdcc small press n free thingssdcc sdcc getnit 
neutral;magic myth opportunist skyjack hit san diego comic con 
neutral;midnight oil wrap sdcc commiss aeon flux 
neutral;mommi pack sdcc catwoman catwomancosplay reevzfx mybitchykitti luna 
neutral;moos make sdcc debut golden jessicak 
neutral;morrilla selfi sdcc everyth need right 
neutral;nnnnnnnice 
neutral;bad room sdcc 
positive;oh crap sdcc weekend much day 
neutral;oliv stone make comiccon debut screen snowden sdcc 
neutral;day time ouat panel sdcc 
neutral;pinback bobbl patina batman funko pop sdcc exclus store mall 
positive;pinback bobbl sdcc doomsday superman v batman funko pop pre order guarante store mall 
neutral;protip wait sdcc get sick fli orlando airport alreadi feel physic exhaust 
neutral;quick stop starbuck quad espresso flight sdcc preflight 
positive;realli excit arrow press room sdcc year send qs way internet friend 
neutral;retweet bill sienkiewicz midnight oil wrap sdcc commiss aeon flux 
neutral;rise shine human time begin journey sdcc hasbrosdcc mtg lastminutepack 
neutral;san diego comic con bound sdcc sdcc sandiegocomiccon 
positive;sdcc comiccon day wedsunday convent center park voucher c end date monday deals_ca 
neutral;sdcc neca alien th anniversari newt action figur limit exclus 
neutral;sdcc sdcc exclus mattel dc super hero girl katana doll figur presal 
neutral;sdcc broadcast thought break badder amp crazi talk sdcc sdcc 
neutral;sdcc ray palmer alia atom lego minifigur vorgestellt promobrick lego 
negative;sdcc commiss aeon flux x xcm watercolor 
neutral;sdcc come sandiegocomiccon comiccon 
negative;sdcc hotel room share avail marriott marqui marina look ppl night wed sunday dm us today 
neutral;sdcc toynami futurama destructor amp bender gender box set limit edit futurama 
neutral;sdcc dk author schedul click detail dks panel sign year san diego comic con 
negative;shit shit shiiiiiiiiit sdcc updat im public wan na either cri scream oh gooooooooooood 
neutral;sign london head sdcc ill sign dks star war booth 
positive;im min tonight feel like want lay sdcc like fanboy hall h pussi 
positive;pretti outstand memori made sdcc see one made best list 
neutral;star trek beyond sdcc come pokemon go get big cnet open_tab ep show note tech news 
neutral;star war may skip sdcc dork right sure isnt 
positive;supernatur alway spn 
positive;thank guy 
negative;that aaalllotttaaaa ink babi 
neutral;adventur begin head sdcc thank inflight read 
neutral;batmanvsupermandawnofjustic experi comiccon dceu sdcc sdcc superman henrycavil 
neutral;journey san diego begin sandiego sdcc 
neutral;kongskullisland panel happen sdcc four day thisisnotadril 
neutral;latest digit comic social thank dcsdcc sdcc 
neutral;latest action figur daili thank sdcc ghostbust 
positive;voyag sdcc begun en rout newark airport havent slept sinc yesterday 
neutral;tsa secur line face san diego come sdcc itmodcon 
neutral;man still one favourit comic book artist time 
neutral;sdcc rumour batwoman oracl supergirl season sound like backdoor pilot bird prey show 
neutral;today ewml et time offici sdcc preview plus startrekbeyond 
neutral;toucharcad wrote batman telltal seri releas august game shown first time 
negative;em time fli whale vagina san diego sdcc sdcc 
positive;excit everyon attend sdcc week fun safe hydrat 
negative;vote klarolin hour left 
neutral;ask sdcc cast joshholloway sarahwaynec peterjacobso colonyusa 
positive;would give left leg sdcc weekend 
positive;wow look 
positive;wow stun work ever 
neutral;writer friend see sdcc fb 
neutral;ya author appear sign sdcc 
neutral;guy want look get awesom origin art go see sdcc 
neutral;fandomcc sdcc im teenag mutant ninja turtl 
neutral;get lucki get 
negative;like know someth lol 
neutral;dude sdcc amp doubledar complet get slime friday helmet goggl readi 
neutral;almost got fight mylittleponi con way theyll let sdcc 
positive;hope get seat excit attend sdcc 
neutral;know joke yes go sdcc friday friday though 
neutral;need go sdcc one year soon 
neutral;readi awesom week show sdcc 
negative;jealous wish could fit suitcas take sdcc 
neutral;yay alreadi list peopl see realli actual list sdcc friend 
neutral;sale sdcc 
negative;alltheth need know 
neutral;amanda say thing weve never sdcc would love go least 
positive;angi vote klarolin 
neutral;guy specif booth sdcc year 
neutral;amp wonder wont wont stream 
neutral;cyn came collect 
neutral;chanc win san diego comiccon intern pass comiccon sdcc 
neutral;hi wont sdcc sorri im also stock older gig 
neutral;hope im botheringbut jare offer still tablehappi sdcc 
neutral;slight upset didnt im go sdcc plan get rest haha 
neutral;im go sleep readi sdcc tomorrow 
neutral;year sinc sdcc past preparti 
negative;anoth reason comiccon need leav san diego could much better sdcc 
neutral;kidcoulson growingmov lol sdcc 
neutral;lol ok need pack sdcc land ish 
neutral;look forward coverag sdcc week 
neutral;man hate well hope see sdcc music video 
positive;man id love get hand one even wasnt sign fun everyon lucki enough attend sdcc 
positive;oh made typo delet toronto sept canadian version sdcc celebr 
neutral;okay buy ticket sdcc go get one thx 
positive;behalf everyon sdcc better phenomen hype brad 
neutral;pleas vote stelena other see import 
positive;r u gon na comiccon sdcc im whole time v excit scifi fantasi movi 
neutral;gon na sdcc mayb expect live reaction sonic livestream friday 
neutral;much dva much junkrat much time go fun amp stress relief sdcc nigh upon feel hype 
positive;sorri hear wont sdcc friend bought birthday present cfx last year hope enjoy 
negative;tweet hes go said hes go snapchat someon hug made big mistak 
positive;wait gloat plot dunno beer idea sound pretti good miss sdcc 
positive;put main plan japan ax sdcc got budget w 
positive;weve ad event hope ad wonder sdcc guid 
neutral;what sdcc fandom fest 
neutral;come san diego sdcc hit balboa park lit baybee 
neutral;attend univers fashion show sdcc support 
neutral;releas pin preview night sdcc 
positive;woot woot proud next stop k im look forward see sdcc xd 
neutral;would still wise still possibl expect hous announc week sdcc come around 
neutral;break song correct sdcc 
neutral;vari petyr realli time travel 
neutral;appar time embarrass sdcc 
negative;fan week sdcc interview cast izombi sure tweet us question 
neutral;reveal new poster lukecag ahead comic con sdcc 
neutral;photograph sdcc take pictur cosplyer cosplay cultur magazin sdcc viraltoday 
neutral;funko exclus pop deadpool cowboy thumb marvel sdcc 
neutral;hour wake upw arriv san diego sdcc 
neutral;time start live vicari friend go sdcc year wooooooo 
positive;ad sdcc luke cage poster marvel netflix wall 
positive;day everi day 
neutral;done pack sdcc tomorrow holi cow 
neutral;pack readi go sdcc tomorrow yet sdcc 
negative;also guy dont even know much heart hurt wont sdcc 
neutral;serious alreadi see tweet sdcc line serious 
neutral;amandarighetti pleas dear pic sandiego comiccon fan kiss 
neutral;american friend go hang boy sdcc 
neutral;alway time sdcc come first amp anyth snag along way great appreci lt 
neutral;anxieti level build let get sdcc go get excit done anticip pleas 
neutral;archi might littl meh yet bettyveronica eva top shelf qualiti betterwithag sdcc 
neutral;arent get korrasami news sdcc kzdnkanwslkndwkln 
neutral;ask jason finn dead yet bellami still aliv 
neutral;sdcc ill new print booth sign guess blurri one mine 
neutral;beauti downtown san diego drink sdcc san diego california 
neutral;like last sdccs total fine go year 
neutral;bring back pog sdcc poshcap skid tabl aa artist alley 
negative;call night beauti san diego got ta wake earli pn breakfast meetup conan sdcc hype 
neutral;cant wait gameofblogg tomorrow night sdcc 
positive;cant wait preview night tomorrow come get grunt b comic small press tabl q comiccon sdcc 
neutral;cant wait til tomorrow night startrekbeyond sdcc 
positive;cant wait get comiccon ill look lukecag best event watch sdcc 
neutral;castlevania vinyl ost dtop mondo sdcc 
neutral;check 
neutral;check sdcc comicon pregam podcast also special guest evo relay_ hyper 
neutral;check allfemal comic book team produc rad comic seri call hex sdcc sdcc 
neutral;check vamp duh xoxox sdcc 
positive;check th year row cant imagin sdcc anywher els thx bonni amp stephani kind servic 
neutral;cnet tweet 
neutral;come ser vote 
positive;come see us today get free thing small press n sdcc sdcc getnit 
neutral;comic con san diego hire super heroin host recharg loung star hotel right outsid sdcc 
neutral;comic vixen season set legend tomorrow cast surpris return sdcc 
neutral;contest knsjcomiconcontest knsjsandiego sdcc sdcc cosplay comiccon knsjfmsandiego 
neutral;dc univers sdcc exclus lobo 
neutral;defamili dont forget vote get scoop sdcc 
negative;delena bc hate stefan nut pus 
neutral;think marvel announc fantast four revert back marvel sdcc 
neutral;anyon know scream sdcc 
neutral;final check list sdcc matter mani time ive done never feel readi xd 
neutral;enter win sdcc exclus enter 
negative;episod schedul funki week one us qual anoth us sdcc well see happen 
negative;ep live batmanbeyond thekillingjok batmantheanimatedseri 
positive;everi day work someth even day arent realli day im sdcc tmrwsun need fuck im vacat 
negative;figur rout press confer locat convent center today gosdcc 
neutral;finish batman telltal game video upload sdcc 
neutral;attend public servic announc pleas dont let realiti sdcc sdcc 
neutral;live vicari comiccon preview imag street sdcc 
neutral;fyi premier sdcc poster tomorrow morn 
neutral;gameofthron banner sdcc halloffac noon san diego convent center 
neutral;get readi comic con avatar state yip yip comiccon sdcc 
positive;get readi go sdcc comic con work folk realli work serious im comic 
neutral;go full tilt intothebadland theme sdcc sdcc 
neutral;gon na go ahead cling technic claim make third book releas summer go summer 
neutral;good show ladi monkey aftershow done year come back next wk sdcctalk blab 
neutral;goodnight san diego tomorrowth fun begin sdcc sdcc 
neutral;got sdcc pubofthron leagu 
neutral;watch first episod puzzl amp dragon head sdcc love great 
neutral;hand sdcc parti nap room that im priorit time san diego 
neutral;head sdcc crystal crypt kick sci fi block film festiv sdcc 
neutral;hellokitti auction sdcc comic con gold sonic hello kitti exclus toynami sanrio sega plush rare ebay 
positive;help homi 
neutral;nail 
neutral;come sdcc 
neutral;hey sdcc attende feed come visit booth wonder crew spongebob comic okay 
neutral;hilari love guy hype thewalkingdead return amp readi sdcc 
neutral;hope everyon go sdcc lot fun stay safe also buy shit 
positive;meet karaok conx 
neutral;envious attend sdcc 
neutral;vacationnnnnnn let sdcc mad begin 
neutral;wait saturday sdcc vaguetweet toloveistotrust totrustistobeliev 
neutral;cant believ work weekend sdcc im go late reveal 
negative;dont know tonight want sdcc begin 
neutral;enter win sdcc prize pack 
neutral;arriv san diego sdcc big troubl littl china sum im feel week 
neutral;know im go sdcc jazz im pretti stoke took gym middl runway 
neutral;like video unbox sdcc arcad edit tmnt action figur 
neutral;like video marvel sdcc amp expect 
neutral;like video xmen tv seri order fox sdcc exclus 
neutral;reckon someon doesnt want leav sdcc 
neutral;find scientist sdcc talk ok 
neutral;wish someon get one 
neutral;icymi blink ad thursday concert san diego sdcc 
neutral;icymi fox sdcc autograph session teenwolf bone lucif 
neutral;icymi sanrio hello sanrio brand launch sdcc exclus food truck goodi 
negative;id watch hell us 
neutral;save aggress live bread water year mayb go japan ax sdcc 
neutral;im pack sdcc 
neutral;im gon na sdcc week come look 
neutral;im look schedul im probabl go make time get supergirl panel sdcc noth hurt 
positive;im eve attend first sdcc im year old hope im geek enough nerd 
neutral;im pack head sd tomorrow comicconnnnnn sdcc 
negative;im plan record someth talk qual feel product actual work qual 
neutral;im see fav artistsppl arriv san diego sdcc im like grabbi hand pleas 
neutral;im proud good friend brian pulido wednesday sdcc pulido return big danc 
neutral;insid sdcc disgust 
neutral;insid sdcc joy 
neutral;insid sdcc sad 
neutral;seem surreal sdcc tomorrow wtf 
neutral;precis sdcc batman 
neutral;chimichanga time deadpool sdcc sdcc 
positive;sdcc week there big fat hungryghostmoon hang sky caught pikachu let celebr 
neutral;ive never met singl person sdcc cosplay finish prior week sdcc ever 
positive;finish annual sdcc dinner w alway love talk con amp hear communiti 
neutral;land san diego pretti certain saw john green airport shuttl anyway sdcc commenc 
neutral;kickstart show various crowdfund project sdcc comiccon 
positive;look good jon find way get franksaysy 
neutral;motu curs three terror vhs tape sdcc 
neutral;motu curs three terror vhs tape sdcc weve featur screen first mas 
neutral;marathon star trek understand what go tomorrow premier sdcc 
negative;mayb show plug 
neutral;mezco mega scale thundercat phase tygra le sdcc comic con exclus 
neutral;mezco thundercat snarf plush le sdcc comic con exclus 
positive;sign ad master sdcc auto post probabl last didnt manag sign sure tri 
neutral;sdcc schedul follow thur go work catch news via amp recap fri ditto sat ditto 
neutral;new kotobukiya preview pic sdcc reveal 
negative;free wifi exhibit hall sdcc didnt even know free wifi last year 
neutral;wifi sdcc convent center sdcc scifi sandiegocomiccon sandiegonew 
negative;nobodi want hear delena im sleep 
neutral;go sdccyou kind forget show go onit seem everybodi preoccupi 
neutral;cours bartend restaur boston sdcc 
neutral;impoanc need huge favor sdcc sdcc comicon supercon 
neutral;oh fuck god wish could go 
neutral;oh god 
positive;oh yeah 
negative;way sdcc cant wait stay realli latewak realli earli manual labor jk fun els hit us 
positive;oooh idri 
neutral;outcastcinemax outcastfox sdcc banner san diego convent center 
neutral;pack sdcc watch fixerupp product zero thank 
positive;pack sdcc cant wait d 
neutral;page specialti cocktail sdcc hotel 
negative;peopl vote delena 
neutral;pleas prepar convers topic train ride tomorrow sdcc comicconisher 
neutral;pretti san diego comiccon sdcc zombi planeswalk magic promo 
neutral;rather go hassl figur one right opt skip enough stress prep sdcc 
neutral;retweet itun trailer watch sdcc bat comin hot legobatmanmovi 
neutral;retweet luna lani busi day finish cosplay sdcc plan patreon shoot tomorrow 
positive;sandiegocomiccon show coverag begin wednesday juli th even sdcc sdcc 
neutral;saturday night supervideogameland sdcc 
neutral;sdcc icon hero thundercat mummra amp mamutt pvc staction figur 
neutral;sdcc comic con exclus hot wheel star trek buick riviera car wspock 
neutral;sdcc exclus voltron legendari defend variant cover comic netflix 
neutral;sdcc brainswalk pano wubrg mtg magicthegath 
neutral;sdcc daysss im get readi like 
neutral;sdcc dayssss im readi like 
neutral;sdcc close omg 
neutral;sdcc wonder sigh wish could 
neutral;sdcc make hope incred time product one 
negative;sdcc pack status ive made stack underwear sock took two hour 
positive;sdcc tomorrow amp rememb w shiftylook friend good time 
neutral;sdcc profil histori display million dollar frank frazetta paint comic con 
positive;sdccno see san fernando valley comic book convent august th sdcc sandiegocomiccon 
neutral;sdcc week got pass cant go guess pokemongo 
positive;sdcc preview exclus giveaway run sunday juli th dont miss chanc 
neutral;sdcc start tomorrow 
neutral;see week comic con im artist alley tabl aa sdcc 
negative;shit forgot buy denim jacket sdcc fuck 
neutral;shock amp awe fig still rock starwar toyphotographi sdcc toycommun 
neutral;smh home girl roxi bout ask trash sdcc 
neutral;sneak peak sdcc sdcc thewalkingdead booth 
positive;great meet guy sdcc 
neutral;much get readi sdcc swear plan play overwatch tonight 
positive;go go make hot chocol get stuck review go sdcc research amwrit 
neutral;els twitter friend sdcc 
neutral;sneak peek set sdcc 
positive;someon pleas take 
neutral;soon 
neutral;still sunday sdcc badg sale hit friend sorri random 
neutral;still salti wont sdcc 
neutral;suicidesquadmovi sdcc samsung hard rock hotel san diego 
positive;thank alreadi favorit sdcc thank much 
neutral;time wait hour onlin wait room hope get sdcc ticket fail gon na hard internet week 
neutral;that hometown 
neutral;bus readi roll south park offsit sdcc 
neutral;ididntgetticket sdcc depress full forc 
neutral;latest entertain today rncincl sdcc 
neutral;latest nichola lind film blog thedarktow sdcc 
neutral;latest takeradiocrew sdcc thedarktow 
neutral;latest guayageek daili thank sdcc geek 
neutral;latest thetvk thank rncincl sdcc 
neutral;copi charli choochoo sdcc gon na hard get one 
neutral;theyr practic show startrekbeyond alreadi sdcc 
neutral;could year particip sdcc 
negative;isnt good comiccon 
negative;shit happen ampowwrless stop haha hilari though 
neutral;probabl come handi 
neutral;time gather sdcc stuff togeth boat load retweet bed 
neutral;tomorrow sdcc 
neutral;toy hype usa origin share first look mattel sdcc exclus mastersoftheunivers shera figur 
neutral;toynami second wave sdcc exclus limit edit preorder via 
neutral;twas night sdcc amp thru apart creatur stir bc watch deadpool 
negative;ugh def avoid dt scenario shape around sdcc 
neutral;unbox sdcc arcad edit tmnt action figur 
neutral;excit head san diego comic con tomorrow sdcc 
neutral;vixen season set legend tomorrow cast surpris return sdcc 
neutral;vixen season set legend tomorrow cast surpris return sdcc vi via 
neutral;vixen season set legend tomorrow cast surpris return sdcc vixen fan sadden 
neutral;vixen season set legend tomorrow cast surpris return sdcc vixen fan sadden 
neutral;vote stelena 
neutral;vote stelena your obes 
negative;vote stelena yall get enough delena bullshit alway question answer 
neutral;vote headlin nsfw ash vs evil dead red band trailer deem gori comiccon 
neutral;vote stelena stelena 
neutral;wait guy sdcc 
positive;want stuck seattl 
neutral;gon na start pack realiz laundri first sleepless night sdcc begin 
neutral;got two differ sdcc pop work today man one soooo ugli love lol 
neutral;hope see sdcc like follow tv panel coloni deadofsumm ouat thestrain amp tbd 
neutral;comic con tomorrow where parti wednesday thursday rum sdcc sdccparti 
neutral;weve ad sdcc sign wb amp fox bob burger gotham supergirl fantast beast amp much 
neutral;ask star amp execut produc stevenkan sdcc thelastship tnt 
positive;sucki teen wolf wifi ill surviv like wifi great 
neutral;theexpans season sdcc syfi 
neutral;go see know ill see guy sdcc sdcc 
neutral;whos go preview night tomorrow sdcc ill explor sdcc 
positive;whos readi comiccon ill emce capcom booth stop say hi check awesom program sdcc 
positive;trash win 
neutral;winter mean sdcc tweet come 
neutral;wiredcaf return th yr sdcc intern ltlt come see train brain control droid 
neutral;wonder woman invis jet unveil tomorrow win tix reveal parti email promot enter sdcc 
neutral;would dope go sdcc bday weekend 
neutral;wray wray 
neutral;yall vote klayley 
neutral;yeah dude 
positive;yep excit movi 
positive;yes fking lucill 
positive;yes pleas 
positive;yoooooo got sdcc pass back b one nerd want take ya 
negative;know well win even shit 
neutral;know creat quit stink know mean welcom sandiego sdcc sdcc 
