neutral;hail rickspringfield supernatur sdcc comiccon lucif spn wbsdcc cwsdcc 
positiv;awesom announc mightampv miss sdcc weekend 
positiv;awesom announc mightv miss sdcc weekend lifehack 
neutral;extrem inspir ladi funni witti like nerdhq sdcc 
neutral;sdcc stir lot emot tax weekend time id never happier time felt realli low 
neutral;what wors video cc april nope didnt get selfi w sdcc must hate 
neutral;ariel littlemermaid bell beautyandthebeast sdcc 
neutral;awesom see star sdcc 
positiv;beauti 
neutral;watch sdcc panel last like day youtub wonder announc 
neutral;betti veronica cheryl idk cast quit far charact 
neutral;big day uh setlock 
negativ;boost follow sdcc urbanroyalti amywinehous 
neutral;boy like figur wan na play learn 
positiv;boy like figur want love im 
positiv;bring sdcc next year ty 
neutral;bruce wayn live batman attic knew 
positiv;one want listen say confirm pokeomongo eeveelut 
neutral;came home trainingtir wild wan na love im 
neutral;came home trainingtir wild wan na play im 
neutral;came home trainingtir wild wan na spend night find name 
positiv;cant wait till next season supergirl 
neutral;casual brows sdcc coverag rpokemongo 
neutral;color us excit best trailer sdcc 
neutral;cruelladevil cosplay sdcc daddi doggi go 
neutral;cute wan na play learn 
positiv;cute want spend night learn 
negativ;damn 
neutral;daredevil season announc sdccs luke cage panel via news break 
neutral;dc charact costum sdcc sdcc suicidesquad wonderwoman 
positiv;disappoint plot origin stori wonder woman meet steve trevor ww amp centuri 
neutral;disgust fear insideout sdcc 
positiv;dncinphl wish peopl paid attent 
positiv;dr strang good sherlock made cri 
neutral;e super mario bros th anniversari gold pin sdcc pax nib new condit 
positiv;enter calendar 
neutral;eu agent beat sdcc blue continu fight roll call thur pm bst saveagentcart agentcart 
neutral;exclus skybound announc sdcc exclus walk dead outcast movi movienew comicbook 
positiv;fan absolut amaz year sdcc humbl great love dcfancast 
neutral;final fantasi xii remast zodiac age gameplay sdcc via 
neutral;look like xena wonderwoman 
neutral;captainmarvel manti badass women marvel cinemat univers sdcc 
positiv;fuck readi shit 
neutral;funkopop freddi funko pop bert pc le sdcc comic con exclus 
neutral;funkopop funko pop sdcc comic con exclus funday willi wonka freddi funko 
neutral;funkopop sdcc exclus funko pop conan obrien zombi halloween conan 
neutral;galgadot wonderwoman movi costum sdcc wbsdcc httpstcoimrxyghz 
neutral;gamora guardiansofthegalaxi harleyquinn cosplay sdcc 
neutral;glad could make final tape live comic con last sat liveatsdcc sdcc 
neutral;gotham star interview sdcc photo 
neutral;guy anyon know happen act strang sdcc 
neutral;h happen remind jerkoff sent u broken box whatuord knowhowdeliverthegood 
neutral;happi thomastuesday sdcc via torrilla 
neutral;harley quinn suicidesquad worst hero ever new remix trailer sdcc 
positiv;perfect 
neutral;henri cavil prank smith amp suicidesquad cast sdcc 
neutral;hey still trap san diego thank aw custom servic sdcc sdcc 
neutral;home mani adventur lot time wait line mr robot best sdcc 
negativ;hugh jackman sdcc make think zuko kid tell scar wrong si 
neutral;ad video playlist sdcc teen wolf press room dylan obrien tyler hoechlin 
neutral;found leak thor ragnarok footag youtub sdcc tho 
neutral;gain follow limf rioolymp sdcc 
neutral;got interview soni latin america sdcc forgot ask could find interview 
neutral;blog im afraid waffl brief run major trailer releas sdcc 
positiv;final made anoth video marvel sdcc 
negativ;get qualiti follow sdcc powershift rulescommitte 
positiv;wan na go sdcc one time 
neutral;left brain sdcc 
positiv;like video teenag mutant ninja turtl vs raph jhonen vasquez sdcc nick 
neutral;like video dead rise kill challeng gameplay sdcc 
positiv;like video halo war new sdcc stori vidoc breakdown 
neutral;like video man buy talk star war bb unit comic con sdcc 
positiv;like video marvel sdcc 
neutral;like video pokemon go sdcc panel infom pokemon go news 
positiv;like video south park th anniversari sdcc hall h panel trey parker 
neutral;like video wonder woman trailer easter egg amp thing miss sdcc 
neutral;love video much favourit video ezra 
neutral;need sit go back throughfinish read rene montoya comic sdcc made miss import 
neutral;saw tom hiddleston im sold 
neutral;think left soul right next ridicul long hall h line 
neutral;took physic challeng destroy doubl dare cours sdcc nerdist 
neutral;walk much sdcc didnt turn pokemongo save batteri could hatch mani egg 
positiv;want wirth 
positiv;would love see movi costum person sdcc dccomic 
neutral;icv sdcc new normal 
neutral;icymi handi repositori best san diego comic con panel sdcc 
neutral;your bore come play let talk 
neutral;il nostro origin team arrow al sdcc d lt 
negativ;im fuck readi 
neutral;sdcc delug news everyon talk mani cbomb muttley drop 
neutral;interview engag cosplay photoshoot sdcc 
neutral;iron take red eye sdcc get bed earlier time last week 
positiv;still cant sleep watch sdcc voltron panel im scream im excit want explod 
neutral;comic anymor see star found sdcc 
neutral;j scott campbel danger girl abbey chase sdcc signatur edit print 
neutral;jareth sarah labyrinth cosplay sdcc 
neutral;juli comic con sdcc th year press 
positiv;klausamphayley wed au klayley theorigin sdcc tvd tvdforev tw stydia 
neutral;kudo surpris world w secret trailer sdcc 
neutral;lea michel emma robert scream queen cast talk season two spoiler sdcc 
positiv;let make like movi shade grey 
neutral;linctavia forev mari avgeropoulo amp ricki whittl sdcc reunion 
neutral;lindsey morgan instagram sdcc 
positiv;liter want life rn video rachel mcadam amp tilda swinton hold hand sdcc gif ya feel ripm 
neutral;lo stand della weta workshop al sdcc 
neutral;man buy talk star war bb unit comic con sdcc 
neutral;marvel studio gave hat comic con sdcc 
neutral;marvel iron fist sdcc first look netflix hd 
neutral;marvel luke cage sdcc teaser netflix hd 
neutral;marvel defend sdcc teaser netflix hd 
neutral;masterpiec bumblebe spike sdcc exclus transform misb hasbro via transform bumblebe sdcc 
neutral;miss trailer preview sdcc click link view 
neutral;film today told sdcc big day 
positiv;motu skeletor amp man power token sdcc rare comic con combo 
neutral;favorit photo tonight melissa benoist sdcc sdcc supergirlcw 
positiv;see sdcc spiderman footag would best day ever 
negativ;oh shit cant wait 
positiv;ok im excit heard heathen got extra excit jsut gonggn 
positiv;ok benni c look realli fkn good sdcc 
neutral;way home crack sdcc thorough enjoy compani excel amp throughout 
negativ;one day ill travel usa attend sdcc 
neutral;first dirk gentl look 
neutral;overheard sdcc talk flopdr eliza lindsey that nice made 
positiv;peopl actual plan see sdcc number peopl actual saw sorri everyon want see gt_lt 
positiv;photo love amp sdcc 
neutral;photo biggest parti comiccon sdcc 
neutral;pinback bobbl funko dorbz dc batman return sdcc gamestop exclus rare store mall 
neutral;pinback bobbl sdcc exclus funko pop hero metal domo batman store mall 
neutral;pls come manila 
neutral;popcast hs san diego comic con sdcc le bilan complet 
neutral;poser 
neutral;protect puppi 
positiv;realli cri 
neutral;rememb ppl come back dont let bait u back give 
neutral;rocket e groot da sideshow sdcc 
neutral;san diego comiccon dc costum exhibit part suicid squad sdcc suicidesquad sdcc 
neutral;san diego comiccon dc costum exhibit part wonder woman sdcc wonderwoman sdcc 
neutral;san diego comiccon star war rogu one costum exhibit sdcc rogueon starwar sdcc 
neutral;sdcc tour experi via 
neutral;sdcc troll macgyv et last ship 
neutral;sdcc news teen wolf end season via news break 
neutral;sdcc san diego comic con sdcc tini titan superhero sidekick gift set new 
neutral;sdcc pop cultur shock american werewolf thing son anarchi toyark news 
neutral;sdcc amp dc comic spoiler dc entertain releas justic leagu team icon symbol dc plan 
neutral;sdcc blizzard exclus overwatch pharah pop 
neutral;sdcc exclus funko pop indiana jone relic sdcc sticker 
neutral;sdcc exclus hasbro marvel legend seri raft boxset spiderman 
neutral;sdcc funko funday larg tshirt bazooka gum style new 
neutral;sdcc hasbro exclus marvel legend abomin raft loos 
neutral;sdcc hasbro exclus star war black seri kylo ren figurein hand 
neutral;sdcc mattel exclus hot wheel star trek buick riviera 
neutral;sdcc news teen wolf end six season via news break 
neutral;sdcc sdcc marvel legend abomin loos figur hasbro raft comic con 
neutral;sdcc sdcc hasbro exclus marvel legend raft spiderman loos figur 
neutral;sdcc sdcc hasbro kylo ren black seri unmask comic con exclus rare 
neutral;sdcc allnew wolverin marvelfan marvel marvelfangirl comic superhero 
neutral;sdcc arrow cast break hamilton song panel 
neutral;sdcc everi major trailer convent 
neutral;sdcc best quot game throne cast amp creator panel 
neutral;sdcc legend tomorrow season legiondari legion doom 
neutral;sdcc upon time adam horowitz amp eddi kitsi 
neutral;sdcc giveaway enter 
neutral;sdcc hasbro set sdcc star war black seri kylo ren obi wan 
neutral;sdcc sdcc blizzard exclus overwatch pharah pop 
neutral;sdcc sdcc exclus hasbro marvel legend seri raft boxset spiderman 
neutral;sdcc sdcc hasbro exclus marvel legend abomin raft loos 
neutral;sdcc star war black seri rf astromech droid sdcc exclus 
neutral;sdcc lego dimens reveal new detail expans et harri potter gremlin lego 
neutral;sdcc exclus mattel thoma friend dc superman batman mini train comiccon 
neutral;sdcc frequenc interview 
neutral;sdcc good klarolin fandom still shook 
neutral;sdccdan grant gustin 
neutral;share suaju sdcc exclus deconnick sebela amp sook launch ghost ongo comic book resourc ghost 
neutral;broli broli dbz dbs supersaiyan ssj goku vegeta anim manga cosplay sdcc love cultur beastmod 
neutral;sherlock doctor strang 
neutral;sherlock doctor strang get p 
neutral;sherlock cast amp sdcc vine httpstcolnvgomwa 
neutral;excit interview sdcc ask sal joe murr q thetenderloin trujok impracticaljok 
neutral;late postsdcc cast news agent shield season featur von strucker twin 
neutral;sonic th anniversari exclus sdcc glamglow graviti mud 
negativ;stanconfess trend know trend weekend sdcc lack free wifi 
neutral;star war black seri rf astromech droid sdcc exclus 
neutral;starwar rd sdcc hasbro exclus star war black seri kylo ren figurein hand theforceawaken 
neutral;starwar rd sdcc limit edit legaci collect mighti morphin power ranger red theforceawaken 
neutral;starwar rd star war han solo bowcast sdcc summer convent exclus funko theforceawaken 
neutral;suicid squad drop exclus sdcc remix trailer 
neutral;superhero film amp tv show sdcc photo post toysrevil toysrevil jul pd 
neutral;supernatur sdcc sam dean new vulner lucif vs castiel promotehorror via cnvey 
negativ;thank sdcc much like death superman final appear ever ill bac 
neutral;flash season sdcc offici trailer 
neutral;greatest thing come sdcc 
neutral;latest thank sdcc mind 
positiv;latest digit comic social thank cupcakewar sdcc 
neutral;latest daili iphon app howitsmad sdcc 
neutral;latest daili news innov howitsmad sdcc 
positiv;latest les chroniqu chenaill thank demsinphilli sdcc 
neutral;latest moneymoney daili sirphilipgreen sdcc 
neutral;latest action figur daili thank sdcc sdcc 
positiv;latest dayli tweeti digest thank demsinphilli sdcc 
positiv;latest lilli evan daili demsinphilli sdcc 
positiv;latest mba today thank econarch sdcc 
positiv;latest nick black daili thank sdcc dncinphl 
positiv;latest norfolk comput daili thank demsinphilli sdcc 
neutral;latest rodney meek daili thewalkingdead sdcc 
positiv;latest screenweek network daili thank sdcc doctorstrang 
positiv;latest steven elard daili thank demsinphilli sdcc 
neutral;latest tech news ahb solut sdcc artificialintellig 
neutral;origin daniel make bottl nois joseph ear sdcc via 
neutral;origin phoeb tonkin pikachu pick line joke sdcc via 
neutral;thewalkingdead season trailer reveal sdcc sdcc 
neutral;coinop inspir tmnt set one favorit thing pick sdcc year turtlepow sdcc 
positiv;gone hella good 
positiv;true love 
neutral;thoma amp friend kid sdcc san diego comic con toy train mini amp cosplay famili toy review via 
neutral;top beauti everafterhigh cedar wood marionett doll sdcc exclus b doll gift 
neutral;video wentworth interview tv line sdcc 
neutral;video gotham cast sdcc 
neutral;vike season sdcc trailer breakdown bjorn sail mediterranean captur ragnar die 
neutral;watch full sdcc call duti infinit warfar panel 
neutral;watch full star trek th anniversari comiccon panel themoviesextra 
neutral;watch full star trek th anniversari comiccon panel themoviesextra 
neutral;wbsdcc wonderwoman movi charact queen hippolyta conni neilsen costum sdcc 
neutral;record tonight focus sdcc trailer news well wwe draft battleground 
neutral;come rest us 
positiv;spidermanhomecom footag sdcc wan na see pleas dont make watch offscreen phone footag 
neutral;heck theorigin prisonbreak panel need see sdcc 
positiv;whoa two hero met that hype 
neutral;wonder woman justic leagu crash sdcc 
neutral;wonder woman justic leagu crash sdcc last coupl year marvel upper hand sdc 
neutral;wonder woman movi costum display sdcc cne 
neutral;wow amaz adventur sdcc sung disney beauti beast song littl town bell 
positiv;wow wow fallout tv seri reveal sdcc 
neutral;yep back nyc long sdcc 
positiv;yo look awesom 
neutral;yo hell 
neutral;know trailer come whenev sdcc happen 
neutral;your queen cosplay 
neutral;mayb temporari ll dieampcom backbut wasnt announc sdcc like tvd 
positiv;love print got sdcc could went one speedforc 
neutral;think grimm sdcc look like fun 
positiv;someon facebook said decemb here link 
positiv;cool brandabl domain name perfect next vr project sdcc pokemongo 
neutral;post sdcc got panel youtub 
neutral;way treat fan day didnt want debut sdcc 
neutral;deal comic outcast sdcc san diego comic con exclus imag comic book new 
neutral;usual love record panel sdcc reason went hight instead full panel year 
positiv;sdcc reaction video 
neutral;solo panel sdcc got gif tumblr 
neutral;yet gif found facebooktumblr record someon sdcc 
positiv;want say anoth big thank pull togeth sdcc video one handi goto place your awesom 
neutral;mango total need watch sdcc panel fuck amaz oh god 
neutral;ok im go share someth weird actual suspicion stream sdcc think mari might 
negativ;part show sdcc 
neutral;sdcc scare theyr manufactur thing hate cast wasnt sad would funni 
neutral;ladi think first justiceleagu trailer releas sdcc 
positiv;thank buddi appreci much man glad good time sdcc 
neutral;talk 
neutral;justiceleagu special sandiegocomiccon footag sdcc 
neutral;kongskullisland offici sandiegocomiccon trailer sdcc 
neutral;wonderwoman sandiegocomiccon trailer sdcc 
positiv;love luci elijah wood ashvsevildead sdcc 
neutral;keep steven univers sdcc panel repeat music beauti 
neutral;speak sdcc movi reveal wonderwoman brought knife gun fight amp still kick major butt 
negativ;share insight supernatur rare serious answer sdcc 
neutral;subt refer spiderman secondti marvel studio hero sdcc recap aint wrong 
neutral;trailer arrow year sdcc 
neutral;spoiler petyr baelish cosplay sdcc via rgameofthron gameofthron 
neutral;spoiler petyr baelish cosplay sdcc 
neutral;photo philip glenist wrenn schmidt siriusxm interview sdcc 
neutral;photograph cosplay pictur sdcc d 
neutral;self sdcc pic mandalorian bounti hunter 
neutral;seriesonday panel de magician sdcc 
neutral;video watch cast enjoy booth sdcc outcast 
neutral;sdcc hasbro gi joe product booth imag action figur toy news via 
neutral;reveal thewalkingdead panel sdcc 
neutral;giant monster johngoodman believ director hit 
positiv;ador littl regina cute 
neutral;drive away fan gain new one w fanboy pander ao last resort sex 
negativ;sdcc sat back amp figur ive lateadopt coolest tv show ever startrek thewir gameofthron got 
neutral;agentsofshield cast sdcc 
negativ;sdcc movi trailer movi news 
positiv;awesom announc mightv miss sdcc weekend relat articl 
neutral;postsdcc sw news either shit that shit sometim 
neutral;sdcc feel homg 
positiv;amaz work 
neutral;andrewlincoln jeffreydeanmorgan stevenyeun normanreedus amp filmmak kevin smith imdb exclus sdcc 
neutral;anim aulti 
negativ;anybodi got ftwd twd lanyard sdcc wan na send throw 
negativ;anyon got feartwd twd lanyard sdcc wan na send throw 
positiv;yr old idol sir keaton cape amp find love albeit diff garb 
neutral;hope precursor proper articl here sdcc trailer 
neutral;least arent litterng career path rubbish integr creativ 
positiv;sdcc two differ produc said next year want yacht year ago comic publish said time chang 
negativ;aw melani dom damn cute 
positiv;awesom pic 
positiv;awesom 
positiv;beach war tee stormtroop starwar rogueon summer beach sdcc 
neutral;beauti theorigin sdcc 
neutral;beb ok havent seen post twit sdcc 
neutral;benedict cumberbatch interview sdcc et canada 
neutral;best toy sdcc comic con marvel aveng cell phone credit card money holder set gift 
positiv;boy like let get acquainteddo wait 
neutral;like gag reel shown sdcc preview aw short 
positiv;cant wait suicidesquad sdcc 
positiv;cant wait 
neutral;couldnt make sddc dave got cover 
neutral;cure hump day blue recap sdcc ampamp top movi villain podernfamili gtgt 
neutral;cuti tvdforev sdcc 
positiv;d sdcc week apart next year rip 
negativ;damn 
neutral;daniel gilli interview origin season sdcc theorigin 
neutral;dave nerd compendium talk biggest comic con year sdcc podcast podbro comiccon 
negativ;dcwb pretti much won sdcc 
neutral;definit greatest shot sdcc suicidesquad trailer thejok harleyquinn best 
positiv;one us bless mani differ way thank sdcc 
positiv;everi time tri say im done collect toy new awesom toy announc 
neutral;fan savefatnfuri sdcc 
neutral;fav tvdforev sdcc 
neutral;fiction vers step cybervers publish sdcc plnws 
neutral;fight club action doll da blitzwat sdcc 
neutral;final sdcc cosplay galleri via 
neutral;final chanc catch sdcc news flash look awesom cyborg kinda offput aquaman total badass 
positiv;find cast feartwd want charact go sdcc 
neutral;first kong skull island trailer land comiccon tomhiddleston brielarson sdcc 
positiv;follow cosplay deadpool comic con sdcc san diego comic con san diego comic con lit 
neutral;arrow walk dead everi tv movi trailer drop sdcc 
neutral;funkopop funko pop sdcc dc flash tv seri flash unmask rare 
neutral;funkopop funko pop sdcc marvel collector corp hobgoblin year one box exclus 
negativ;grantgust brother profession photograph work wb sdcc 
neutral;guardiansofthegalaxyvol comic con trailer breakdown sdcc 
neutral;happyhumpday optimist say yes yes dont stop manhug tomhiddleston zacharylevi sdcc hcjl d 
neutral;haramb tribut movi 
neutral;listen week podcast sdcc recap ep live trailerpark nwgls podernfamili 
neutral;vote favorit trailer sdcc hrs left poll marvel dc movi 
neutral;big 
neutral;univers fashion show marvel wall game throne amp sdcc via 
neutral;hes talk hall h public mayb tbh fan won sdcc amaz 
neutral;hi huge fan cr saw guy sdcc im travel nycc year hope u guy go 
positiv;hot damn tvdforev sdcc 
neutral;acquir pet name proxi wigwednesday sdcc lolita steampunk gothiclolitawig glw drabbit dragon 
neutral;ad video playlist sdcc recap 
neutral;ad video playlist sdcc supernatur cast jensen ackl facebook livestream misha 
neutral;ad video playlist sdcc supernatur cast misha collin facebook livestream 
neutral;ad video playlist supernatur season gag reel sdcc 
neutral;ad video playlist supernatur season teaser soon sdcc 
neutral;disagre bring back mark pellegrino pleas 
positiv;think one cw produc ever gave idea good feel 
positiv;wasnt want shi bad 
neutral;idw announc misfit seri spin jem hologram sdcc 
neutral;anyon pic sdcc either eric alex p 
positiv;your bore let play wait 
neutral;youv read alreadi watch one funniest court transcript ever read 
negativ;ill jump cliff isnt talk bellark 
neutral;im tad emot right tvdforev sdcc 
negativ;im batman cant wait new movi 
negativ;im 
positiv;im love 
neutral;im readi year time jump theorigin sdcc 
neutral;im tote jelli 
positiv;im watch favorit sdcc panel 
neutral;instavid taylor publicist roger amp cowan sdcc 
neutral;canadian american 
positiv;idiot emot entir sdcc wish happi birthday hes happi bc shes happi 
neutral;would happen either wayit suck happen 
neutral;time week spartan 
neutral;time new dnc cover sdcc podernfamili podbro podcast nerd geek 
negativ;ive watch gif mani time 
neutral;j scott campbel littl red ride hood sdcc signatur edit print 
neutral;kong island trailer kinda cool curious see 
neutral;kong skull island trailer p flac ac kongskullisland sdcc 
neutral;last chanc sdcc summer convent exclus patriot peanut snoopi funko pop sdcc charliebrown 
neutral;lego ironman amp captain america brickheadz sdcc set unbox build time laps review via 
neutral;like youtub south park sdcc trump return 
neutral;live periscop im nigga turnt earli sdcc rncincl easteregg birthday 
positiv;liveact ragman wow amp thought life complet saw anim aztek jlu dccomic 
neutral;londoncallingsigh benedict cumberbatch sdcc via 
positiv;look 
neutral;look like nail vietnam vibe warnerbroth kongskullisland legendarypictur 
neutral;loool got panel sdcc even pathet last year bunch support charact get much screen time 
positiv;love samuraijack 
neutral;love cosplay deadpool comic con sdcc san diego comic con san diego comic con lit 
neutral;marvel deliv yet year sdcc nice reveal second trailer doctor strang 
negativ;marvel vs dc sdcc here need know wednesdaywisdom 
neutral;marvel agent shield season teaser sdcc 
neutral;marvel iron fist sdcc first look netflix hd via 
neutral;parent 
neutral;miss last week sdcc rodcast read summari gearsofwar 
neutral;miss news sdcc wynonnaearp renew nd season 
neutral;love matt key doctor strang trailer breakdown sdcc recap marvel movi ne via 
neutral;motu princ adam sdcc comiccon exclus loyal subject 
neutral;mr robot vr experi debut sdcc mrrobot via 
positiv;favorit 
neutral;note justic leagu sdcc firstlook trailer reactionreview 
neutral;nathan fillion sdcc 
neutral;new episod nerd porn live episod san diego comic con sdcc stranger thing soundcloud 
neutral;new hobi ep right talk cloverfieldlan amp news sdcc sdcc dcu 
neutral;new podcast full sdcc roundup thought wonder woman jl doctor strang 
neutral;new poster agentsofshield sdcc 
neutral;new stock come soon walk dead burn walker sdcc 
neutral;new trend gif via giphi gif 
positiv;order sdcc exclus pop refresh email time check ship cant wait arriv 
neutral;origin court script recit rick amp morti sdcc sligth nsfw script 
neutral;ouat cast sdcc 
neutral;breakdown analysi thewalkingdead season sdcc trailer 
neutral;panel de magician sdcc 
neutral;panel de time time sdcc 
neutral;photo time sdcc 
neutral;pinback bobbl funko pop sdcc big bang theori sheldon cooper batman tshirt comic con store mall 
neutral;pinback bobbl sdcc exclus funko pop batman vs superman fals god 
neutral;pinback bobbl sdcc funko pop suicid squad batman exclus store mall 
neutral;pin movi sdcc movi trailer ttdd 
neutral;pop star war episod vii han solo bowcast sdcc exclus collect price eta 
positiv;promis must com back tv seri 
neutral;rare new hot sdcc comic con exclus shopkin jessicak golden shoppi 
neutral;read teenag comment spn cast interview sdcc like 
neutral;rewind sdcc americangod take us storm 
neutral;rickandmorti recreat america bonker court transcript sdcc 
neutral;roundup sdcc mcu marvel sdcc 
neutral;trailer arrow year sdcc 
neutral;trailer arrow year sdcc 
neutral;samurai jack poster reveal sdcc via 
neutral;saya suka video marvel luke cage sdcc teaser netflix hd 
negativ;sdcc recap sdcc 
neutral;sdcc comic con exclus shopkin shoppi jessicak gold extrem rare 
neutral;sdcc comic con exclus shopkin shoppi jessicak gold extrem rare bidsend date 
neutral;sdcc exclus bandai power ranger red ranger legaci collect figur 
neutral;sdcc exclus hasbro marvel legend seri raft boxset spiderman 
neutral;sdcc exclus mattel monster high ghostbust franki stein doll 
neutral;sdcc exclus motu mark taylor pofolio limit edit heman 
neutral;sdcc dcs legend tomorrow first look trailer amp panel via news break 
neutral;sdcc john semper talk cyborg movi movienew comicbook 
neutral;sdcc king arthur legend sword trailer unveil charliehunnam kingarthur 
neutral;sdcc upon time bring aladdin charact whole new world 
neutral;sdcc grant gustin wore flash tshirt ezra miller wore flash snapback love 
neutral;sdcc giveaway enter 
neutral;sdcc haul broli exclus batman toy rd amp 
neutral;sdcc definit bucket list jealous everyon went year 
neutral;sdcc like huge gift box new season trailer faith geek realiz 
neutral;sdcc mosquito beaten despit antihistamin look like allerg reaction happen anyway ah well doctor 
neutral;sdcc muppet figur super beaker san diego comic con exclus seal 
negativ;sdcc pic courtesi nerdpic 
neutral;sdcc pokemon th anniversari ash amp pikachu figur set sdcc comic con exclus 
neutral;sdcc diamond select toy 
neutral;sdcc trailer lego batman movi batman 
neutral;sdcc lightsoutmovi cast interview 
neutral;see wonder woman movi trailer releas comiccon sdcc sdcc 
neutral;flawless ouat sdcc 
negativ;happi tater tot sdcc im cri 
neutral;sherlock sdcc panel 
neutral;shutterstocknow flash sstk portrait studio sdcc shutterstocknow 
neutral;sign tabl ouat sdcc 
positiv;awesom craftmenship costum sdcc 
positiv;ive watch sdcc panel favorit show straight day big deal 
neutral;thing never chang sdcc sdcc 
neutral;someon need aggreg vr comiccon pleas point global domin sdcc 
neutral;south park sdcc pc princip languag polic 
neutral;south park sdcc pokemon go 
neutral;south park sdcc pokemon go treypark 
neutral;star war annoy orang sdcc exclus fan boy talk rare funni joke 
neutral;starwar sdcc hasbro star war black seri kylo ren forc awaken exclus buzz 
