neutral;trailer arrow year sdcc 
neutral;yep hes definit sdcc biggest stage pimp shit show 
positiv;cant wait hear wtf jatan say sdcc perfect venu add bait lower dd con 
neutral;see thing ask sdcc 
neutral;schneider ngoma sdcc releas soon dont miss one 
neutral;ask tvd press sdcc sterolin ride stefan motorbik next season thank 
neutral;could ask sdcc tvd press stefan dress santa claus carolin twin thank 
neutral;could ask sterolin ever snow kiss interview tvd cast crew sdcc thank 
neutral;could ask tvd cast juli sterolin june wed sdcc 
neutral;flash wbsdcc sdcc 
neutral;hi cover tvd press sdcc could ask sterolin june wed propos cabin possibl 
neutral;hi cover tvd sdcc could ask well see stefan take carolin fall someday thank 
neutral;hi pleas ask paul candicejuli sdcc sterolin scene come first episod tvd 
neutral;feel ya get sleep next week butit worth sdcc 
neutral;cover tvd press sdcc ask well ever see sterolin watch notebook friend pleas haha 
neutral;im tri find littl info deadpool bluray sdcc most price special restrict line 
negativ;lmao meeeeeeee final get ass unpack caus pack go sd comic con rli sdcc 
positiv;martin get inspir jane charact choos jaimi rolesdcc blindspot 
negativ;sdcc 
neutral;pleas ask sterolinejunewed sdcc interview tvd cast crew 
positiv;readi sdcc cant wait see 
negativ;sdcc shirt think although may requir preorder investig 
neutral;sdcc tmnt brilliant yes pleas kid would love rted 
neutral;joker might say someth 
neutral;sdcc whole new world duh 
positiv;excit dctv 
neutral;well pleas amend initi tweet track timestamp endur sdcc talk resurfac 
negativ;day gon na sdcc 
positiv;wish go sdcc could hang 
positiv;news e anteprim toynami stealth voltron ex sdcc 
neutral;promobrick sdcc ray palmer alia atom lego minifigur vorgestellt brickrss lego 
neutral;ad littl detail axe earlier today take hour nap back work sdcc one day 
neutral;almost flight time sdcc come 
neutral;journey begin sdcc current manchest airport 
neutral;andrea roth entertain week sdcc celebr andrearoth 
negativ;anoth year anoth sdcc cant attend 
neutral;airport head sdcc im readi sdcc 
negativ;bitch 
negativ;board plane way la sdcc 
neutral;bruh 
neutral;power grayskul childhoodnostalgia heman 
neutral;calm storm sdcc sandiego 
positiv;cant believ ill miss year sdcc 
neutral;complimentari second bag check win especi probabl overweight overs fli sdcc 
negativ;couldnt sleep shit insomnia excit got plan budget im sure wont happen sdcc sdcc 
neutral;dc comic lil bombshel cryptozo sale sdcc 
neutral;erin richard gotham press line sdcc erinrichard 
neutral;exclus captainamerica first aveng amp antman poster sdcc week 
neutral;final board first flight sdcc btw mention hate fli deep breath itll ok 
neutral;futurama robot santa bender action figur two pack comic con sdcc futurama 
neutral;geofdarrow x threea ltd edit poster avail sdcc booth detail 
positiv;gorgeous 
neutral;harleyquinn invad sdcc cgc ss blue rrp sketch variant lot sign 
neutral;heman master univers philip tan sign sdcc sketch variant motu 
neutral;hey ha 
positiv;hey mike need look get sdcc amp say hi mr 
neutral;hey year im go sdcc tabl ill sign marvel booth thursday pm whos come 
neutral;claim 
positiv;enter win sdcc prize pack 
negativ;hate let sdcc get im hope camp use go longer say cant allow girl join boy trip 
neutral;clue im wear sdcc halp 
neutral;icymi green arrow flash amp supergirl appear conan sdcc 
neutral;icymi icymi green arrow flash amp supergirl appear conan sdcc 
neutral;think im go watch batman movi order prepar sdcc your fool 
positiv;im sdcc life great saw justic leagu panel entir cast finish zack snyder walk mic amp say 
positiv;im excit attend mtv teen wolf comiccon come sdcc 
negativ;im readi 
negativ;intermedi group spin tonight sdcc usual approx km steadi pace welcom 
neutral;join us sdcc week number special event special guest tsutomu nihei creator blame 
neutral;juli comic con sdcc th year press 
neutral;leg one journey sdcc begin got pick car take airport 
neutral;lego sdcc dc comic ray palmer atom minifigur exclus confirmend minifig price guid lego 
positiv;let friend sdcc small press n free thingssdcc sdcc getnit 
neutral;magic myth opportunist skyjack hit san diego comic con 
neutral;midnight oil wrap sdcc commiss aeon flux 
neutral;mommi pack sdcc catwoman catwomancosplay reevzfx mybitchykitti luna 
neutral;moos make sdcc debut golden jessicak 
neutral;morrilla selfi sdcc everyth need right 
neutral;nnnnnnnice 
neutral;bad room sdcc 
neutral;oh crap sdcc weekend much day 
neutral;oliv stone make comiccon debut screen snowden sdcc 
neutral;day time ouat panel sdcc 
neutral;pinback bobbl patina batman funko pop sdcc exclus store mall 
neutral;pinback bobbl sdcc doomsday superman v batman funko pop pre order guarante store mall 
positiv;protip wait sdcc get sick fli orlando airport alreadi feel physic exhaust 
negativ;quick stop starbuck quad espresso flight sdcc preflight 
positiv;realli excit arrow press room sdcc year send qs way internet friend 
neutral;retweet bill sienkiewicz midnight oil wrap sdcc commiss aeon flux 
neutral;rise shine human time begin journey sdcc hasbrosdcc mtg lastminutepack 
neutral;san diego comic con bound sdcc sdcc sandiegocomiccon 
neutral;sdcc comiccon day wedsunday convent center park voucher c end date monday deals_ca 
neutral;sdcc neca alien th anniversari newt action figur limit exclus 
neutral;sdcc sdcc exclus mattel dc super hero girl katana doll figur presal 
neutral;sdcc broadcast thought break badder amp crazi talk sdcc sdcc 
neutral;sdcc ray palmer alia atom lego minifigur vorgestellt promobrick lego 
neutral;sdcc commiss aeon flux x xcm watercolor 
neutral;sdcc come sandiegocomiccon comiccon 
positiv;sdcc hotel room share avail marriott marqui marina look ppl night wed sunday dm us today 
neutral;sdcc toynami futurama destructor amp bender gender box set limit edit futurama 
neutral;sdcc dk author schedul click detail dks panel sign year san diego comic con 
negativ;shit shit shiiiiiiiiit sdcc updat im public wan na either cri scream oh gooooooooooood 
neutral;sign london head sdcc ill sign dks star war booth 
neutral;im min tonight feel like want lay sdcc like fanboy hall h pussi 
positiv;pretti outstand memori made sdcc see one made best list 
neutral;star trek beyond sdcc come pokemon go get big cnet open_tab ep show note tech news 
neutral;star war may skip sdcc dork right sure isnt 
positiv;supernatur alway spn 
positiv;thank guy 
negativ;that aaalllotttaaaa ink babi 
positiv;adventur begin head sdcc thank inflight read 
neutral;batmanvsupermandawnofjustic experi comiccon dceu sdcc sdcc superman henrycavil 
positiv;journey san diego begin sandiego sdcc 
neutral;kongskullisland panel happen sdcc four day thisisnotadril 
positiv;latest digit comic social thank dcsdcc sdcc 
positiv;latest action figur daili thank sdcc ghostbust 
neutral;voyag sdcc begun en rout newark airport havent slept sinc yesterday 
neutral;tsa secur line face san diego come sdcc itmodcon 
negativ;man still one favourit comic book artist time 
neutral;sdcc rumour batwoman oracl supergirl season sound like backdoor pilot bird prey show 
neutral;today ewml et time offici sdcc preview plus startrekbeyond 
neutral;toucharcad wrote batman telltal seri releas august game shown first time 
neutral;em time fli whale vagina san diego sdcc sdcc 
positiv;excit everyon attend sdcc week fun safe hydrat 
neutral;vote klarolin hour left 
neutral;ask sdcc cast joshholloway sarahwaynec peterjacobso colonyusa 
positiv;would give left leg sdcc weekend 
positiv;wow look 
positiv;wow stun work ever 
neutral;writer friend see sdcc fb 
neutral;ya author appear sign sdcc 
positiv;guy want look get awesom origin art go see sdcc 
neutral;fandomcc sdcc im teenag mutant ninja turtl 
negativ;get lucki get 
neutral;like know someth lol 
positiv;dude sdcc amp doubledar complet get slime friday helmet goggl readi 
neutral;almost got fight mylittleponi con way theyll let sdcc 
negativ;hope get seat excit attend sdcc 
neutral;know joke yes go sdcc friday friday though 
positiv;need go sdcc one year soon 
neutral;readi awesom week show sdcc 
positiv;jealous wish could fit suitcas take sdcc 
neutral;yay alreadi list peopl see realli actual list sdcc friend 
neutral;sale sdcc 
positiv;alltheth need know 
positiv;amanda say thing weve never sdcc would love go least 
neutral;angi vote klarolin 
neutral;guy specif booth sdcc year 
negativ;amp wonder wont wont stream 
neutral;cyn came collect 
positiv;chanc win san diego comiccon intern pass comiccon sdcc 
neutral;hi wont sdcc sorri im also stock older gig 
positiv;hope im botheringbut jare offer still tablehappi sdcc 
neutral;slight upset didnt im go sdcc plan get rest haha 
positiv;im go sleep readi sdcc tomorrow 
neutral;year sinc sdcc past preparti 
positiv;anoth reason comiccon need leav san diego could much better sdcc 
neutral;kidcoulson growingmov lol sdcc 
neutral;lol ok need pack sdcc land ish 
neutral;look forward coverag sdcc week 
neutral;man hate well hope see sdcc music video 
positiv;man id love get hand one even wasnt sign fun everyon lucki enough attend sdcc 
neutral;oh made typo delet toronto sept canadian version sdcc celebr 
positiv;okay buy ticket sdcc go get one thx 
neutral;behalf everyon sdcc better phenomen hype brad 
neutral;pleas vote stelena other see import 
negativ;r u gon na comiccon sdcc im whole time v excit scifi fantasi movi 
neutral;gon na sdcc mayb expect live reaction sonic livestream friday 
positiv;much dva much junkrat much time go fun amp stress relief sdcc nigh upon feel hype 
neutral;sorri hear wont sdcc friend bought birthday present cfx last year hope enjoy 
neutral;tweet hes go said hes go snapchat someon hug made big mistak 
neutral;wait gloat plot dunno beer idea sound pretti good miss sdcc 
neutral;put main plan japan ax sdcc got budget w 
neutral;weve ad event hope ad wonder sdcc guid 
neutral;what sdcc fandom fest 
neutral;come san diego sdcc hit balboa park lit baybee 
neutral;attend univers fashion show sdcc support 
neutral;releas pin preview night sdcc 
positiv;woot woot proud next stop k im look forward see sdcc xd 
neutral;would still wise still possibl expect hous announc week sdcc come around 
neutral;break song correct sdcc 
neutral;vari petyr realli time travel 
neutral;appar time embarrass sdcc 
neutral;fan week sdcc interview cast izombi sure tweet us question 
neutral;reveal new poster lukecag ahead comic con sdcc 
neutral;photograph sdcc take pictur cosplyer cosplay cultur magazin sdcc viraltoday 
neutral;funko exclus pop deadpool cowboy thumb marvel sdcc 
positiv;hour wake upw arriv san diego sdcc 
neutral;time start live vicari friend go sdcc year wooooooo 
neutral;ad sdcc luke cage poster marvel netflix wall 
negativ;day everi day 
neutral;done pack sdcc tomorrow holi cow 
neutral;pack readi go sdcc tomorrow yet sdcc 
negativ;also guy dont even know much heart hurt wont sdcc 
neutral;serious alreadi see tweet sdcc line serious 
neutral;amandarighetti pleas dear pic sandiego comiccon fan kiss 
neutral;american friend go hang boy sdcc 
positiv;alway time sdcc come first amp anyth snag along way great appreci lt 
positiv;anxieti level build let get sdcc go get excit done anticip pleas 
neutral;archi might littl meh yet bettyveronica eva top shelf qualiti betterwithag sdcc 
positiv;arent get korrasami news sdcc kzdnkanwslkndwkln 
neutral;ask jason finn dead yet bellami still aliv 
neutral;sdcc ill new print booth sign guess blurri one mine 
neutral;beauti downtown san diego drink sdcc san diego california 
neutral;like last sdccs total fine go year 
neutral;bring back pog sdcc poshcap skid tabl aa artist alley 
neutral;call night beauti san diego got ta wake earli pn breakfast meetup conan sdcc hype 
positiv;cant wait gameofblogg tomorrow night sdcc 
positiv;cant wait preview night tomorrow come get grunt b comic small press tabl q comiccon sdcc 
positiv;cant wait til tomorrow night startrekbeyond sdcc 
positiv;cant wait get comiccon ill look lukecag best event watch sdcc 
neutral;castlevania vinyl ost dtop mondo sdcc 
neutral;check 
neutral;check sdcc comicon pregam podcast also special guest evo relay_ hyper 
neutral;check allfemal comic book team produc rad comic seri call hex sdcc sdcc 
neutral;check vamp duh xoxox sdcc 
negativ;check th year row cant imagin sdcc anywher els thx bonni amp stephani kind servic 
negativ;cnet tweet 
neutral;come ser vote 
positiv;come see us today get free thing small press n sdcc sdcc getnit 
neutral;comic con san diego hire super heroin host recharg loung star hotel right outsid sdcc 
neutral;comic vixen season set legend tomorrow cast surpris return sdcc 
neutral;contest knsjcomiconcontest knsjsandiego sdcc sdcc cosplay comiccon knsjfmsandiego 
neutral;dc univers sdcc exclus lobo 
neutral;defamili dont forget vote get scoop sdcc 
neutral;delena bc hate stefan nut pus 
neutral;think marvel announc fantast four revert back marvel sdcc 
neutral;anyon know scream sdcc 
neutral;final check list sdcc matter mani time ive done never feel readi xd 
positiv;enter win sdcc exclus enter 
positiv;episod schedul funki week one us qual anoth us sdcc well see happen 
neutral;ep live batmanbeyond thekillingjok batmantheanimatedseri 
negativ;everi day work someth even day arent realli day im sdcc tmrwsun need fuck im vacat 
neutral;figur rout press confer locat convent center today gosdcc 
neutral;finish batman telltal game video upload sdcc 
neutral;attend public servic announc pleas dont let realiti sdcc sdcc 
neutral;live vicari comiccon preview imag street sdcc 
neutral;fyi premier sdcc poster tomorrow morn 
neutral;gameofthron banner sdcc halloffac noon san diego convent center 
negativ;get readi comic con avatar state yip yip comiccon sdcc 
neutral;get readi go sdcc comic con work folk realli work serious im comic 
neutral;go full tilt intothebadland theme sdcc sdcc 
neutral;gon na go ahead cling technic claim make third book releas summer go summer 
positiv;good show ladi monkey aftershow done year come back next wk sdcctalk blab 
neutral;goodnight san diego tomorrowth fun begin sdcc sdcc 
neutral;got sdcc pubofthron leagu 
positiv;watch first episod puzzl amp dragon head sdcc love great 
positiv;hand sdcc parti nap room that im priorit time san diego 
neutral;head sdcc crystal crypt kick sci fi block film festiv sdcc 
neutral;hellokitti auction sdcc comic con gold sonic hello kitti exclus toynami sanrio sega plush rare ebay 
negativ;help homi 
neutral;nail 
positiv;come sdcc 
neutral;hey sdcc attende feed come visit booth wonder crew spongebob comic okay 
positiv;hilari love guy hype thewalkingdead return amp readi sdcc 
negativ;hope everyon go sdcc lot fun stay safe also buy shit 
positiv;meet karaok conx 
neutral;envious attend sdcc 
negativ;vacationnnnnnn let sdcc mad begin 
neutral;wait saturday sdcc vaguetweet toloveistotrust totrustistobeliev 
negativ;cant believ work weekend sdcc im go late reveal 
neutral;dont know tonight want sdcc begin 
positiv;enter win sdcc prize pack 
positiv;arriv san diego sdcc big troubl littl china sum im feel week 
neutral;know im go sdcc jazz im pretti stoke took gym middl runway 
neutral;like video unbox sdcc arcad edit tmnt action figur 
positiv;like video marvel sdcc amp expect 
positiv;like video xmen tv seri order fox sdcc exclus 
positiv;reckon someon doesnt want leav sdcc 
neutral;find scientist sdcc talk ok 
positiv;wish someon get one 
positiv;icymi blink ad thursday concert san diego sdcc 
neutral;icymi fox sdcc autograph session teenwolf bone lucif 
neutral;icymi sanrio hello sanrio brand launch sdcc exclus food truck goodi 
negativ;id watch hell us 
positiv;save aggress live bread water year mayb go japan ax sdcc 
neutral;im pack sdcc 
negativ;im gon na sdcc week come look 
neutral;im look schedul im probabl go make time get supergirl panel sdcc noth hurt 
neutral;im eve attend first sdcc im year old hope im geek enough nerd 
neutral;im pack head sd tomorrow comicconnnnnn sdcc 
neutral;im plan record someth talk qual feel product actual work qual 
neutral;im see fav artistsppl arriv san diego sdcc im like grabbi hand pleas 
neutral;im proud good friend brian pulido wednesday sdcc pulido return big danc 
neutral;insid sdcc disgust 
neutral;insid sdcc joy 
neutral;insid sdcc sad 
neutral;seem surreal sdcc tomorrow wtf 
neutral;precis sdcc batman 
neutral;chimichanga time deadpool sdcc sdcc 
neutral;sdcc week there big fat hungryghostmoon hang sky caught pikachu let celebr 
neutral;ive never met singl person sdcc cosplay finish prior week sdcc ever 
positiv;finish annual sdcc dinner w alway love talk con amp hear communiti 
positiv;land san diego pretti certain saw john green airport shuttl anyway sdcc commenc 
neutral;kickstart show various crowdfund project sdcc comiccon 
positiv;look good jon find way get franksaysy 
neutral;motu curs three terror vhs tape sdcc 
neutral;motu curs three terror vhs tape sdcc weve featur screen first mas 
neutral;marathon star trek understand what go tomorrow premier sdcc 
neutral;mayb show plug 
neutral;mezco mega scale thundercat phase tygra le sdcc comic con exclus 
neutral;mezco thundercat snarf plush le sdcc comic con exclus 
neutral;sign ad master sdcc auto post probabl last didnt manag sign sure tri 
neutral;sdcc schedul follow thur go work catch news via amp recap fri ditto sat ditto 
neutral;new kotobukiya preview pic sdcc reveal 
neutral;free wifi exhibit hall sdcc didnt even know free wifi last year 
neutral;wifi sdcc convent center sdcc scifi sandiegocomiccon sandiegonew 
positiv;nobodi want hear delena im sleep 
positiv;go sdccyou kind forget show go onit seem everybodi preoccupi 
neutral;cours bartend restaur boston sdcc 
neutral;impoanc need huge favor sdcc sdcc comicon supercon 
neutral;oh fuck god wish could go 
neutral;oh god 
neutral;oh yeah 
positiv;way sdcc cant wait stay realli latewak realli earli manual labor jk fun els hit us 
neutral;oooh idri 
neutral;outcastcinemax outcastfox sdcc banner san diego convent center 
positiv;pack sdcc watch fixerupp product zero thank 
positiv;pack sdcc cant wait d 
neutral;page specialti cocktail sdcc hotel 
neutral;peopl vote delena 
neutral;pleas prepar convers topic train ride tomorrow sdcc comicconisher 
positiv;pretti san diego comiccon sdcc zombi planeswalk magic promo 
positiv;rather go hassl figur one right opt skip enough stress prep sdcc 
neutral;retweet itun trailer watch sdcc bat comin hot legobatmanmovi 
neutral;retweet luna lani busi day finish cosplay sdcc plan patreon shoot tomorrow 
neutral;sandiegocomiccon show coverag begin wednesday juli th even sdcc sdcc 
neutral;saturday night supervideogameland sdcc 
neutral;sdcc icon hero thundercat mummra amp mamutt pvc staction figur 
neutral;sdcc comic con exclus hot wheel star trek buick riviera car wspock 
neutral;sdcc exclus voltron legendari defend variant cover comic netflix 
neutral;sdcc brainswalk pano wubrg mtg magicthegath 
neutral;sdcc daysss im get readi like 
neutral;sdcc dayssss im readi like 
neutral;sdcc close omg 
positiv;sdcc wonder sigh wish could 
positiv;sdcc make hope incred time product one 
neutral;sdcc pack status ive made stack underwear sock took two hour 
neutral;sdcc tomorrow amp rememb w shiftylook friend good time 
neutral;sdcc profil histori display million dollar frank frazetta paint comic con 
neutral;sdccno see san fernando valley comic book convent august th sdcc sandiegocomiccon 
neutral;sdcc week got pass cant go guess pokemongo 
neutral;sdcc preview exclus giveaway run sunday juli th dont miss chanc 
neutral;sdcc start tomorrow 
neutral;see week comic con im artist alley tabl aa sdcc 
negativ;shit forgot buy denim jacket sdcc fuck 
neutral;shock amp awe fig still rock starwar toyphotographi sdcc toycommun 
neutral;smh home girl roxi bout ask trash sdcc 
neutral;sneak peak sdcc sdcc thewalkingdead booth 
positiv;great meet guy sdcc 
negativ;much get readi sdcc swear plan play overwatch tonight 
positiv;go go make hot chocol get stuck review go sdcc research amwrit 
neutral;els twitter friend sdcc 
neutral;sneak peek set sdcc 
neutral;someon pleas take 
neutral;soon 
neutral;still sunday sdcc badg sale hit friend sorri random 
negativ;still salti wont sdcc 
positiv;suicidesquadmovi sdcc samsung hard rock hotel san diego 
positiv;thank alreadi favorit sdcc thank much 
negativ;time wait hour onlin wait room hope get sdcc ticket fail gon na hard internet week 
positiv;that hometown 
neutral;bus readi roll south park offsit sdcc 
neutral;ididntgetticket sdcc depress full forc 
neutral;latest entertain today rncincl sdcc 
neutral;latest nichola lind film blog thedarktow sdcc 
neutral;latest takeradiocrew sdcc thedarktow 
positiv;latest guayageek daili thank sdcc geek 
neutral;latest thetvk thank rncincl sdcc 
neutral;copi charli choochoo sdcc gon na hard get one 
neutral;theyr practic show startrekbeyond alreadi sdcc 
neutral;could year particip sdcc 
positiv;isnt good comiccon 
neutral;shit happen ampowwrless stop haha hilari though 
neutral;probabl come handi 
neutral;time gather sdcc stuff togeth boat load retweet bed 
neutral;tomorrow sdcc 
neutral;toy hype usa origin share first look mattel sdcc exclus mastersoftheunivers shera figur 
neutral;toynami second wave sdcc exclus limit edit preorder via 
neutral;twas night sdcc amp thru apart creatur stir bc watch deadpool 
neutral;ugh def avoid dt scenario shape around sdcc 
positiv;unbox sdcc arcad edit tmnt action figur 
neutral;excit head san diego comic con tomorrow sdcc 
neutral;vixen season set legend tomorrow cast surpris return sdcc 
neutral;vixen season set legend tomorrow cast surpris return sdcc vi via 
neutral;vixen season set legend tomorrow cast surpris return sdcc vixen fan sadden 
neutral;vixen season set legend tomorrow cast surpris return sdcc vixen fan sadden 
neutral;vote stelena 
neutral;vote stelena your obes 
neutral;vote stelena yall get enough delena bullshit alway question answer 
neutral;vote headlin nsfw ash vs evil dead red band trailer deem gori comiccon 
neutral;vote stelena stelena 
neutral;wait guy sdcc 
positiv;want stuck seattl 
neutral;gon na start pack realiz laundri first sleepless night sdcc begin 
positiv;got two differ sdcc pop work today man one soooo ugli love lol 
neutral;hope see sdcc like follow tv panel coloni deadofsumm ouat thestrain amp tbd 
positiv;comic con tomorrow where parti wednesday thursday rum sdcc sdccparti 
negativ;weve ad sdcc sign wb amp fox bob burger gotham supergirl fantast beast amp much 
neutral;ask star amp execut produc stevenkan sdcc thelastship tnt 
negativ;sucki teen wolf wifi ill surviv like wifi great 
neutral;theexpans season sdcc syfi 
neutral;go see know ill see guy sdcc sdcc 
neutral;whos go preview night tomorrow sdcc ill explor sdcc 
neutral;whos readi comiccon ill emce capcom booth stop say hi check awesom program sdcc 
positiv;trash win 
neutral;winter mean sdcc tweet come 
neutral;wiredcaf return th yr sdcc intern ltlt come see train brain control droid 
positiv;wonder woman invis jet unveil tomorrow win tix reveal parti email promot enter sdcc 
negativ;would dope go sdcc bday weekend 
neutral;wray wray 
neutral;yall vote klayley 
positiv;yeah dude 
positiv;yep excit movi 
neutral;yes fking lucill 
neutral;yes pleas 
positiv;yoooooo got sdcc pass back b one nerd want take ya 
neutral;know well win even shit 
neutral;know creat quit stink know mean welcom sandiego sdcc sdcc 
positiv;wait hour spoke love sw custom servic rep back track get sdcc 
positiv;emma play bitchi charact screamqueen sdcc xx 
positiv;emma favorit chanel outfit screamqueen sdcc 
positiv;jaimi favourit investig first season blindspot sdcc 
neutral;jami possibl make movi jake gyllenha sdcc screamqueen 
neutral;close up tmnt sdcc neca 
neutral;know sdcc pop vinyl live websit might store thank 
negativ;flight got cancel southwest get sdcc make wan na drink defiant listen 
neutral;jaimi favourit investig first season blindspot sdcc xx 
negativ;gon na blackest sdcc evah 
negativ;think two situat thatd benefit sdcc aint one 
neutral;im staff sdcc amp chanc see last sign shift dc booth ill go earli 
positiv;morn tcur sdcc tc websit u need map compass find share fb twt ur vidiosthank good ytube 
positiv;mtvhottest ladi gaga 
neutral;straight focus sdcc 
neutral;that reason sdcc fun walk amp fun guy last year 
neutral;miss rubi sdcc 
neutral;sex bobomb pack avail onlin store blog say 
positiv;x emma favorit chanel outfit screamqueen sdcc 
negativ;ever consid gofundm get next year sdcc 
neutral;rosa park roll paper refer sdcc 
neutral;drop mic 
negativ;team sdcc activ 
neutral;sdcc mezco one collect marvel 
neutral;sdcc mezco toy one collect dc comic 
neutral;closeup joker outfit display sdcc batman tight 
neutral;aka sit tweetdeck pant larg box goldfish friday saturday 
negativ;anoth year goe amp still cant go sdcc 
positiv;anyon go sdcc week wish 
negativ;reprint snake amp sonic 
neutral;bluefin exclus broli sdcc comic con dragonbal z sh figuart hand starwar 
neutral;chill amp sdcc hotel salomar pool bar 
negativ;current mood depress sdcc 
neutral;dapper chris pine costum wonder woman sdcc 
positiv;day sdcc met person motiv today amp ty push us get sdccfit 
neutral;deadpool bluray sdcc exclus sign ryanreynold new collect buzz 
neutral;destructoid sdcc good smile compani via tomopop streamaleart 
neutral;doctorstrang trailer featur benedictcumberbatch marvel booth sdcc 
neutral;enorm bum miss sdcc year glad see post show amaz preview new art 
neutral;final met con unicorn seen mani socal con never courag say hi gameofblogg sdcc ty 
neutral;firework star trek beyond comic con sdcc 
neutral;firework star trek beyond comic con sdcc news 
positiv;emma favorit chanel outfit screamqueen sdcc xx 
positiv;jaimi favourit investig first season blindspot sdcc 
neutral;jami possibl make movi jake gyllenha sdcc screamqueen 
neutral;fuck yeah 
