neutral;thewalkingdead season get new detail telltal sdcc 
neutral;deserv farewel panel sepanx 
neutral;much sdcc sdcc 
neutral;today pleas take moment mourn loss golden era otherwis known sdcc 
negativ;accur hurt 
neutral;trailer gt check new look suicidesquad 
neutral;vengeanc come marvel agentsofshield scifi comedi drama action mysteri sdcc ghostrid 
neutral;well look sdcc comiccon bang bang 
neutral;comiccon guy see photo sdcc sdcc 
positiv;tonight watch girl perform mean automat win life today 
neutral;lindsey 
neutral;place sdcc comiccon 
neutral;say im fine mean sdcc fuck unaccept unfair im gon na fling sun 
neutral;what like comiccon sdcc crowd still worth 
neutral;hannib avail order 
positiv;wow thank thank thank amaz d arrow 
neutral;yes big action huge big death weve mani alreadi vike sdcc 
neutral;forget 
neutral;new bond jamesbond barbarabroccoli stephenamel sdcc 
neutral;sdcc first trailer guy ritchi king arthur 
neutral;hello hi wave sdcc san diego comic con 
neutral;hi wave sdcc san diego comic con 
positiv;cool meet great sdcc 
neutral;sad agre suck happen despit liter boo sdcc wait 
positiv;ohmygod need amaz good 
positiv;photo came 
neutral;life doesnt give seat belt sdcc batman lego 
positiv;go good 
positiv;cri beauti 
neutral;trailer arrow year sdcc 
neutral;sdcc primer vistazo al buitr en spiderman homecom 
positiv;pretti dam sweet comic movi sdcc great hype 
neutral;min fame panel actual turn quit huge kevinsmith still sdcc 
positiv;absolut love tweet sdcc blackheroesmatt 
positiv;actual want see movi 
neutral;watch multitud trailer movi im excit fantast beast kong skull island amp justic leagu sdcc 
neutral;ahh man marvel panel sdcc kill excit level right 
positiv;ahhhh cant wait season 
neutral;trailer sdcc look realli neat must say 
positiv;alway love coverag sdcc thank hard work 
negativ;alycia outfit sdcc biggest bless 
neutral;amazigg 
neutral;anonym said sdcc organ set second tabl minut panel love everyon 
neutral;arrow season sdcc promo 
neutral;babbyyi 
neutral;bad park found near sdcc quot recent acquir magnet seem appropri 
neutral;badass wonder woman trailer captain marvel justiceleagu trailer might best sdcc ever 
positiv;basic sdcc look good last night 
negativ;best day ever sdcc 
positiv;best pic sdcc far 
neutral;best thing sdcc new trailer grabbi hand 
negativ;bitch fuck yes 
negativ;fuck bucki 
negativ;cant cope marvel dc news sdcc much 
positiv;cant wait sc impend end 
negativ;cant waittttt 
neutral;che filmon 
neutral;check new comiccon trailer suicidesquad sdcc comiccon 
negativ;click away easiest way stay fit without exercis hit link stay fit sdcc 
neutral;come outtttt alreadi 
neutral;congratul 
neutral;costum n jacket view captain marvel vasc auspol black panther sdcc pokemongo 
negativ;date save 
neutral;david ramsey arrow sdcc via diggl 
neutral;dc trailer marvel give trailer sdcc hallh 
neutral;dccomic news sdcc flash season trailer releas 
neutral;doctor strang offici trailer sdcc 
neutral;doctorstrang unlik marvelstudio film judg trailer look awesom sdcc marvelsdcc 
positiv;doubl wow 
neutral;everyon give aquaman shit talk fish one give ww guff abil talk everi anim fizzvscom sdcc 
negativ;excus cri eye 
neutral;ezra miller barri allen first trailer justiceleagu sdcc gtgt 
neutral;ezra miller arriv san diego comic con fantasticbeast justiceleagu sdcc gtgt 
negativ;fuck 
negativ;fuck yea 
neutral;get readi sdcc sunday go enter tournament nintendo playground 
neutral;gif hello hi wave sdcc san diego comic con 
neutral;gif time hello hi wave sdcc san diego comic con 
neutral;gif hello hi wave sdcc san diego comic con 
positiv;good morn beauti peopl may enjoy today prisonbreak sdcc 
positiv;good news favourit actress get cw seri regular contract 
neutral;good night leav lukecag good hand marvel luke cage sdcc teaser via 
neutral;take apart edit pc review start back tomorrow also talk thing sdcc week 
neutral;hello hi wave sdcc san diego comic con 
neutral;heroichollywood first trailer fxs legion debut sdcc 
neutral;hey curious like flash suit jl trailer sdcc justiceleagu 
negativ;hey internet what time watch sdcc trailer never got around last night o 
positiv;hey look amaz peopl one pic god treasur 
neutral;couldnt happier everyth happen sdcc year eventhou aveng cast brett dalton werent 
positiv;dont care good see lt myonlyrealcelebritycrush 
neutral;dont want like fuck look amaz im torn boycot due whitewash like 
neutral;feelth 
positiv;enter win copi fangirl life enter sdcc 
positiv;want sdcc 
positiv;like video teenag mutant ninja turtl vs raph jhonen vasquez sdcc nick 
positiv;love cast that thank bid good day squadgoal gothamsdcc 
neutral;think get use see actor charact forget theyr pack big ol theater nerd 
neutral;want go sdcc pleaseeee 
positiv;want watch 
neutral;sdcc could calm pleas ive got mani trailer watch 
neutral;im aliv 
neutral;im shook 
negativ;im emot su panel sdcc especi one question lgbtqwoman empower theme god 
neutral;news im incred jealous everyon sdcc also sky blue oneyeariwillgoanditwillbeawesom 
positiv;offic got excit doctorstrang wonderwoman lukecag bring sdcc 
neutral;introduct benedict sdcc marvel panel 
neutral;ridicul say dc better sdcc simpl fact wont releas footag shown 
neutral;ive never sdcc ive heard yarn ill tell credul bendsthemind 
positiv;watch backstag parti video katheryn winnick wan na go pleas sdcc 
neutral;last week 
neutral;latest hello hi wave sdcc san diego comic con httpstcokbgphwxa 
neutral;legion trailer sdcc 
neutral;let take look incred harley quinn cosplay saw sdcc ignaccess gamedev 
neutral;lol welcom 
neutral;love hello hi wave sdcc san diego comic con 
negativ;marvel announc cast black panther includ walk dead danai gurira 
positiv;marvel cant wait fall changethedestini 
neutral;seeingread sdcc moment announc 
positiv;sdcc like 
neutral;wonder drop sdcc podcast episod 
positiv;readi 
neutral;multipass 
positiv;bodi readi 
negativ;never thought two accent 
neutral;new amp trend hello hi wave sdcc san diego comic con researchpreneur via giphi 
neutral;new doctor strang trailer 
neutral;new post arrow season sdcc promo 
neutral;new trend gif tag hello hi wave sdcc san diego comic con 
neutral;new trend gif via giphi gif 
neutral;newt 
positiv;nice littl insight season love quot end gotatlant 
neutral;nigga extrem right look like older version alexi sanchez 
neutral;oh wow 
positiv;ok look cool still dk went bendysnap carrotstick 
neutral;omg forgot ew sdcc portrait 
neutral;waterfront terri sdcc frat 
neutral;ooh trailer check morn thank sdcc comiccon 
neutral;ooooh lucki us 
positiv;orphan blackampth origin cast best best that want say sdcc 
neutral;probabl favourit news sdcc 
negativ;sad didnt get go sdcc mani thing afoot wouldnt time enjoy proper 
neutral;sdcc ghost rider confirm marvel agent shield via 
neutral;sdcc upon time lana parrilla amp jare gilmor 
neutral;sdcc asksherlockhow go moriarityhow moriar fake dead 
neutral;sdcc lego batman movi trailer see return arnett brick knight comic book resourc via 
positiv;serious isnt sdcc huge miss opportun especi show vr want get 
neutral;shes queen k sdcc wtf 
neutral;shot 
positiv;amaz 
neutral;went sdcc impract joker parti awesom saw guy liiiiter ft away murr point 
neutral;mani thing gg sdcc cant keep 
positiv;think news excit 
neutral;sophi turner iwan rheon game throne sdcc panel g 
positiv;still wait photo amp sdcc 
neutral;tallahasse pokemon dncleak sdcc jimbo fisher gucci whatiddofordollar thatpersonwho 
neutral;second pictur tower terror switch lol 
positiv;that die 
neutral;edg market stori via sdcc market 
neutral;latest cpcconsult daili sdcc arrow 
positiv;latest el market intellig diario thank travel sdcc 
positiv;latest gem group headlin thank sdcc entertain 
neutral;latest radio freedom forthehord sdcc 
neutral;latest synchron sdcc wonderwoman 
positiv;latest albareh daili thank marvelsdcc sdcc 
positiv;latest dotnet time thank kolkata sdcc 
positiv;latest hightech daili fren thank sdcc wonderwoman 
neutral;latest itali properti daili sdcc ewcomiccon 
positiv;latest parti pal daili thank sdcc comiccon 
neutral;latest today hotelslaconia lp sdcc 
neutral;marvel cast matter 
negativ;score make hea hu 
neutral;vampir diari cast sdcc tvdforev tvds tvd tvdfamili comiccon friendship tvdcast 
negativ;worst thing sdcc feed know lack mental abil enjoy 
neutral;comiccon trailer insan doctorstrang marvelsdcc 
neutral;theyr attract im sweatin 
negativ;film gon na soooo trippi 
neutral;also saw come better elizabeth debicki ayesha 
positiv;excit noth great feedback sdcc valerian muchexcit 
positiv;look amaz 
positiv;made weekend cant wait 
negativ;tsano chad make sure dont make vedu danai carri huni nemusoro one scene 
neutral;tt new zealand mastermindnz theblocknz nzgather yearsofonedirect wonder woman sdcc chief 
neutral;tyler beggin scott doesnt realiz miss get obsess tri rescu stile teenwolf sdcc 
negativ;tyler cant one alpha teenwolf sdcc 
neutral;tylerhoechlin supergirl interview sdcc entertain week 
positiv;ugh cant wait 
neutral;rare toxi sale tomorrow sdcc hurri gone 
neutral;vote headlin time sdcc parti 
positiv;eatin good tonit 
negativ;well traumat 
negativ;great day 
neutral;saw clip aladdin amp jafar wonder jasmin come ace ouat 
positiv;whenev hear sudden want kick somebodi ass coincid 
negativ;hell bucki 
neutral;must poor california sdcc need 
neutral;r u look bae im right 
neutral;wonder woman look better justic leagu trailer anyway sdcc dc 
neutral;wonder woman star fuck guy wonder woman 
neutral;wonderwoman put lasso truth good use sdcc trailer 
positiv;yall 
positiv;need frame room lol 
neutral;yyyyeessssssssssssss 
positiv;hope win great competit also follow legosdcc sdcc 
neutral;follow messag good luck everyon enter competit legosdcc sdcc 
neutral;lol wtf 
neutral;special sdcc 
positiv;there awesom panel screen sdcc nycc ce bare get anyth awesom 
neutral;like justic leagu footag drop sdcc 
neutral;howardchaykin great sdcc sdcc 
neutral;annnnnnnnnnnnd noth els matter see movi wonderwoman sdcc 
neutral;idea sdcc exclus go sale onlin look pick copi magic gather promo sdcc 
neutral;know sdcc spn panel intro 
neutral;first trailer sdcc justiceleagu 
neutral;goodluckeveryon like magician say pick card hope mine fantasticbeast wand hallh sdcc beawizard 
neutral;hey guy chanc youll get sdcc funim beerus pop vinyl atal 
neutral;hi dan sdcc haul went thursday night sorri wasnt one one 
positiv;im alreadi get idea 
neutral;justic leagu trailer easter egg amp thing miss sdcc video justic leagu trailer easter egg 
neutral;emili wife went stalk sdcc didnt need look place 
positiv;beauti outfit stun cant wait see kick assum 
positiv;look amaz 
neutral;trailer du sdcc meet evil en vostfr 
neutral;well yeh least got pic yknow serious got least one sdcc would satisfi like year 
positiv;wish awesom upcom week miss volz hope sdcc good 
positiv;cant let starfox starfoxsdccsdcccosplay 
neutral;funko pop serious 
neutral;dead 
neutral;video kat cast wynonnaearp sdcc panel via kindaoffkilt youtub 
neutral;sdcc exclus hasbro star war black seri obi wan comic con 
neutral;sdcc exclus hasbro star war black seri obi wan comic con 
neutral;sdcc exclus hasbro star war black seri obi wan comic con starwar 
neutral;sdcc exclus marvel legend raft set spiderman loos action figur 
neutral;awesom photo marvel toy sdcc tx ign 
neutral;new heir hous bolton 
positiv;actual tom think whether hed shot also took long time come three 
neutral;alien weaver talk alien futur sdcc panel alien 
neutral;big news sdcc last weekend 
neutral;amanda mark tom comic con sdcc 
neutral;american horror stori season spoiler theme unveil sdcc emma robert teas show e 
neutral;american horror stori season theme hint sdcc horror hospit experi fx reveal 
neutral;sdcc check fearless vr experi creepi fxsdcc 
positiv;much love jensen amp co sad see appar jare enough lead solo panel sdcc nerdhq 
neutral;sdcc talk ruthconnel supernatur rowena 
neutral;aww cuti 
positiv;beauti 
neutral;benedict cumberbatch sdcc say sherlock lock 
negativ;benedictcumberbatch sdcc fr home one night edit 
neutral;bonecrunch new footag luke cage marvel netflix sdcc sizzl reel 
positiv;bonni good thing good 
neutral;bree turner sdcc grimm 
neutral;bts interview comicconhq sdcc hilton san diego bayfront 
neutral;btw team pokemongo 
positiv;bye sandiegocomiccon swell see next year sdcc 
neutral;bye sdcc time realiti 
neutral;call duti sdcc narrat panel spaceship backstori kit harington callofduti 
neutral;cant believ sdcc made back hour drive thank various traffic accid along way back 
neutral;captain swan 
neutral;catch sweet news sdcc start well carol danver follow wonderwoman trailer 
neutral;caught sdcc trailer justic leagu king arthur guy ritchi fantasyy highlight 
neutral;check guardian galaxi vol marvel sdcc exclus concept art print hand via 
neutral;check mondo exclus mega man capcom lapel pin sdcc one enamel nintendo via 
neutral;check sdcc dc pin set batman superman robin rebih watchmen via 
neutral;check sdcc dc pin set rebih watchmen triniti batman superman wonder woman robin via 
neutral;check sdcc exclus hasbro micronaut pharoid classic set hand comic hasbro via 
neutral;check sdcc hellboy dark hors tote bag mignola via 
neutral;check sdcc mattel mighti mini dean ambros mattel via 
neutral;check sdcc kingdomheart unchain poster squar enix disney via 
neutral;check super muto heman token coin sdcc via 
neutral;check wonderwoman badass offici trailer sdcc gtgt 
neutral;clair coffe sdcc grimm 
neutral;cockl pretti pleas pictur jensen amp misha sdcc send realli want tl 
neutral;codi dylan fan sdcc 
negativ;codi cute omg cri 
neutral;comiccon keep busi morn must watch trailer sdcc 
neutral;comic justiceleagu sdcc recap julio pic vid amp info 
negativ;communiti download sdcc vr experi excit via virtualr vr 
neutral;costum n jacket view sdcc climatechang upupcronulla lacours sitg 
positiv;creat crazi scari cool fxsdcc sdcc americanhorrorstori vr 
positiv;cute 
negativ;exact 
neutral;film news updat stori via sdcc sdcc 
neutral;first full trailer releas fantast beast find eddieredmayn 
neutral;captainmarvel manti badass women marvel cinemat univers sdcc 
neutral;funkopop duck dodger white gamma sdcc exclus funko pop 
neutral;funkopop funko pop dragon ball z metal beerus card sdcc exclus 
positiv;gain free new follow sdcc pagan towerofterror 
positiv;good 
positiv;good morn monday catch sdcc trailer news excit 
neutral;gosh spoiler open supernatur panel sdcc 
neutral;got ta go fast sdcc sdcc sonic 
neutral;great new origin fresh intro marvel badass 
positiv;great team theorigin sdcc amp 
positiv;hahaha waaaahhh wan na see wan na see cosplay wan na sit hall one oh h sdcc 
neutral;sdcc withdraw 
neutral;hello sdcc pleas watch ambiti batman vs jack ripper fan film thank ripper horror 
neutral;here learn teenwolfseason sdcc teenwolfsdcc teenwolf 
neutral;ho aggiunto un video una playlist di benedict cumberbatch sdcc say 
neutral;honor spock adam nimoy father legaci star trek th anniversari via 
neutral;human anchor yes 
neutral;ad video playlist justic leagu trailer easter egg amp thing miss sdcc 
neutral;ad video playlist wonder woman trailer easter egg amp thing miss sdcc 
positiv;final know look like love version harleyquinn arkham game love pic sdcc 
neutral;watch lot sdcc stuff thevampirediari cast drunk tvline favourit 
positiv;like video marvel studio sdcc panel highlight nerdist news w jessica chobot 
positiv;like video open supernatur panel sdcc 
neutral;like video justic leagu drop sdcc trailer review amp brake 
positiv;like video sdcc supernatur jare padalecki 
positiv;like video sdcc supernatur jare padalecki 
neutral;live john barrowman oh myyyy 
neutral;lov thi 
neutral;post photo facebook album sdcc 
neutral;return sdcc found hous turn ant hill hate summer 
neutral;saw photo mad sdcc actual terrifi guy dunno 
positiv;saw import thing impala 
neutral;still plenti time ruin movi 
positiv;wait year 
neutral;youv seen check trailer final fantasi xvs kingsglaiv movi sdcc 
positiv;im actual extrem jealous everyon got go sdcc sooooo mani celeb want meet note self futur goal 
negativ;im gon na cri wan na sdcc 
positiv;im love wonder woman 
neutral;im one 
positiv;im happi home sdcc much fun most thank two best friend gt 
negativ;im think up game 
neutral;sdcc comic anymor seem like e juli 
neutral;go get big bigger vr 
neutral;ive pay attn sdcc look like ill catch movi trailer amp geek news get home 
neutral;jackson dncinphl powertv pentaconk msnewsnow sdcc fort myer aldon smith oahu 
neutral;john fantasi come true 
positiv;get lana del rey spooki cover sugar sugar your set 
positiv;need monday morn doctorwho starwar sdcc lightsab timelord theforc comforttv 
neutral;keep eye open new independ short fanorama live action futurama film sdcc 
neutral;kid toy sdcc exclus entertain earth batman v superman joker wild big sale deal 
neutral;kingarthur get guy ritchi treatment legend sword trailer sdcc comiccon 
neutral;last day sdcc awesom swagger level 
positiv;love u guy sm 
neutral;love trailer sdcc esp wonderwoman kongskullisland amp doctorstrang 
positiv;love pic happi liam sharp 
neutral;man propos girlfriend comic con alien panel sdcc 
neutral;marvel anim announc aveng secret war releas teaser rocket amp groot short 
neutral;marvel agent shield season teaser sdcc agentsofshield ghostrid marvel marvelsdcc sdcc 
neutral;marvel iron fist sdcc first look netflix hd via 
neutral;marvel defend offici sdcc trailer netflix san diego c via 
positiv;mate your even jim gordon yet 
positiv;want 
positiv;michael b jordan perfect everi way 
neutral;morn decent sleep breakfast time catch everythng sdcc crack knuckl 
neutral;mr dickhead 
neutral;multipl pictur come sdcc norman reedus jdm peak fluster 
neutral;starwar jersey hit sdcc got lot compliment even silent bob agre 
neutral;feed mix sona postsdcc benedict cumberbatch goodi good 
neutral;nathan fillion nerdhq sdcc con man panel twelfth precinct 
neutral;new artwork sdcc sdcc cwsdcc riverdal archi archiecom comic comiccon comiccon 
neutral;noth like come back sdcc delay flight amp hous degre due non function acffffantast 
positiv;sdcc ia year best thing get internet buybuybuy marvel hottoy dc twd ftwd 
neutral;ok note grantgustin sdcc 
neutral;omg dean hot sam tie like sexi toy 
positiv;oooh nice 
positiv;open supernatur panel sdcc via 
neutral;great comiccon draw close weve still got news show stick around 
neutral;pinback bobbl dorbz batman return pack batman catwoman penguin funko sdcc exclus store mall 
neutral;potenti leak onlin sdcc sdcc lego legosdcc powerrangersmovi powerang legodimens lego 
neutral;retweet castl th precinct castl news nathan fillion nerdhq sdcc con man panel 
neutral;retweet megan sdcc komatsumegan defend email dncleak guy didnt account 
neutral;rick morti denver allen court case sdcc 
neutral;sdcc woman woman full panel 
neutral;sdcc sdcc exclus hasbro star war black seri obi wan comic con 
neutral;sdcc sdcc exclus marvel legend raft set spiderman loos action figur 
neutral;sdcc ampspiderman homecomingamp introduc villain marvelfan marv 
neutral;sdcc import takeaway supernatur panel amp via news break 
neutral;sdcc batman amp robin join forc new lego batman movi trailer 
neutral;sdcc behold eight new clip featur differ member suicid squad 
neutral;sdcc comiccon trailer give sneak peek season arrow 
neutral;sdcc con man season two interview nolan north casper van dien via 
neutral;sdcc fear walk dead season b trailer comicbook 
neutral;sdcc heat exchang fan batman kill joke creativ team 
neutral;sdcc jame gunn elabor starlord father guardian galaxi vol 
neutral;sdcc marvel unveil hulk armor thor ragnarok 
neutral;sdcc melissa benoist talk catco chang up ant kryptonian armi 
neutral;sdcc season vampir diari last 
neutral;sdcc day cosplay featur overwatch marvel 
neutral;sdcc godzilla san diego comic con exclus bluefin 
neutral;sdcc gotten pretti hype suicid squad good job market wb 
neutral;sdcc come take soul leav 
negativ;sdcc news marvel reveal michael b jordan black panther role 
neutral;sdcc sdcc exclus batman logo bust anim seri comiccon statu 
neutral;sdcc sdcc exclus hasbro micronaut pharoid classic set hand comic 
neutral;sdcc arrow season comiccon trailer reveal new villain prometheus via news break 
neutral;sdcc garth enni pen dastard muttley seri dc 
neutral;sdcc marvel anim announc aveng secret war releas teaser rocket amp groot short 
neutral;sdcc gif 
positiv;sdcc done met bunch great beard noshav 
neutral;sdcc sdcc supernatur cast nerdhq spam lol poor mark p 
neutral;sdcc talk new batma 
neutral;serial trailer sdcc im look forward dirk gentl legion defend iron fist 
positiv;ador 
neutral;full blown cupcak sdcc 
neutral;sherinford 
neutral;mani sdcc panel watch d right entertain work animag cosplay theflash 
neutral;much cool news sdcc weekend surpris got sever trailer releas internet event 
neutral;major comic announc sdcc sdcc comiccon 
positiv;cool stuff sdcc 
positiv;men want watch timelin burn 
neutral;pic form san diego comic con thank comic con amaz day sdcc 
neutral;spec op line get sdcc 
neutral;spiderman surpris sdcc here first look concept art featur vultur spidermanhomecom 
positiv;squirrel girl need happen often fb 
neutral;star trek discoveri offici trailer sdcc ncc via 
neutral;star trek watch star trek th anniversari panel sdcc 
neutral;startrek alien cast member tri launch nostalg space trip sdcc 
neutral;stephen amel e luke perri lt sdcc 
negativ;gorgeous peopl 
neutral;supernatur cast rick springfield new lucif vessel comiccon sdcc 
neutral;supernatur comic con hamster sdcc via 
neutral;supernatur goe back basic bring back horror feel sdcc 
neutral;team leader interact new featur teas pokemongo sdcc panel 
negativ;thank memori sdcc arigatou everyon help send info merci everyon hallh 
neutral;thank fun time sdcc blast 
neutral;that better duh sdcc arrow 
neutral;th season thewalkingdead worth wait say sdcc 
neutral;beach san diego realli beauti sandiego sdcc beach pacif beach sd 
neutral;best cosplay costum sdcc 
positiv;latest daili poptweetz thank sdcc lfc 
neutral;latest defalt x star sdcc art 
positiv;latest les chroniqu chenaill thank sdcc anim 
positiv;latest sciencecafeensched week thank utwent sdcc 
positiv;latest cape luxuri car daili thank travel sdcc 
positiv;latest cocker daili thank fintech sdcc 
positiv;latest david dellacasa daili thank sdcc market 
positiv;latest dystopian daili thank sdcc rio 
positiv;latest lewisham dreamer daili thank hiv sdcc 
positiv;latest mma blogospher thank wwebattleground sdcc 
positiv;latest norfolk comput daili thank sdcc ewcomiccon 
positiv;latest steven elard daili thank theprojecttv sdcc 
positiv;latest trend fashion daili thank sdcc musicmonday 
neutral;origin charl michael davi interview afterbuzztv sdcc via 
neutral;alreadi look better dawn justic 
positiv;made even excit look sad cant even anymor bc dean sam cas tho 
neutral;gon lit bruh 
neutral;pure art im talki 
positiv;photo save 
neutral;trailer resmi wonder woman o 
neutral;unfortun sdcc wont gencon look sdcc host montemoor 
neutral;video prison break cast sign autograph sdcc 
neutral;watch cod infinit warfar sdcc panel right via 
neutral;coordin happen mononok princessmononok ashitaka cosplay sdcc sdcc 
neutral;blast sdcc respons new storyworld rang unreal sold drwho set 
negativ;screw 
neutral;launch sdcc pop cwb shop reserv hold first come first serv 
positiv;weekend catch latest announc sdcc 
neutral;gon na sdcc 
neutral;got geek comic con year 
positiv;day fill sdcc footag thank 
positiv;work weekend see mani tweet sdcc miracul wish bthere happi everyon therelt 
positiv;cast good look 
neutral;news sdcc past weekend episod berserk kinda lost hubbub gtgt 
positiv;wonder woman king kong trailer might miss sdcc 
neutral;wonderwoman showcas fight prowess latest trailer sdcc comiccon 
positiv;woot woot cant wait till novemb doctorstrang 
neutral;yall dont know much love exorcist book lol 
neutral;yall real map 
negativ;yes sdcc benedictcumberbatch sherlockhair 
neutral;sdcc got footag r gon na sharenthat fan like sdcc exclus 
neutral;big mycroftsherlock scene said sdcc studio hensol castl use diogen club 
neutral;high time djdndkd u guy seen sdcc entranc hahahaha 
neutral;dont put podcast regular peopl abandon especi around sdcc expect better stabl 
positiv;sdcc hope your get rest x 
positiv;need marvel 
neutral;ill get one day prioriti moment like brunch clexacon sdcc 
negativ;im realli sure much choic lol sdcc great market tool 
neutral;new convers batman amp joker chuck taylor size men women sdcc suicid squad 
neutral;separ note might get sdcc exclus alien newt figur your interest obv wont cheap tho 
negativ;successlegaci alien sudden sequel becam consid littl viabl 
positiv;girl second one video sound like 
positiv;thought might want follow 
neutral;first say privat life job differ thing sdcc bite hand ate 
negativ;dont care hes second speed forc run hes flash day last day 
neutral;find way im still sdcc 
neutral;top comic con trend list sdcc sdcc 
neutral;sorri dccomic won sdcc start deeper hole mix manofsteelhorr bvs review 
positiv;met sdcc love inspir daughter sky aspir femal author 
neutral;photo cast sirius xm sdcc outcast 
neutral;photograph steampunk harley quinn sdcc unknown cosplay 
neutral;wccftech wonder woman justic leagu crash sdcc 
neutral;coolest thing sdcc jessica jone action fig 
neutral;san diego comic con sdcc tini titan superhero sidekick gift set new 
neutral;sdcc star war black seri stormtroop forc awaken action figur 
neutral;sdcc marvel legend abomin loos figur hasbro raft comic con 
neutral;sdcc hasbro kylo ren black seri unmask comic con exclus rare 
neutral;trailer sdcc might miss comiccon comiccon movi 
negativ;th hour alreadi tuesday sdcc day ago still homecom footag wan na fight energi though 
neutral;et discuss gotham news sdcc beyond 
