neutral;funko pop exclus pharah overwatch blizzard exclus sdcc vinyl hand 
neutral;go wait almost hour ahead sdcc news greec 
neutral;got poster sign previewnightsdcc sdcc dccomic 
neutral;hasbro exclus star war black seri obi wan kenobi figur sdcc 
neutral;hasbro star war black seri obiwan kenobi pack sdcc comic con exclus 
positiv;becom coolest version thank new hat hey thank gameofthron cc sdccconiv 
neutral;question ask sdcc 
neutral;hey everyon sorri delay upload late ive compil legodimens news massiv sdcc news updat 
neutral;hotel mate sleep apnea flashback hes even bed hesit get comfort send help sdcc 
neutral;hottoy reveal marvel daredevilfigur daredevil mcu charliecox netflix daredevil sdcc marvelsdcc 
neutral;next day go like sdcc 
neutral;husband put wetsuit random said sure someon photograph benedict lhr lax cumberbatch sdcc 
neutral;color cover ducktal cinestori comic disney sdcc sdcc 
negativ;feel like benedict get hate peopl hes sdcc realli shouldnt mani peopl hope 
positiv;hope lana stylist sdcc eye fine beauti mayb someth gay 
positiv;enter win copi fangirl life enter sdcc 
negativ;tear littl bit 
positiv;like video gear war sdcc new campaign gameplay marcus fenix 
positiv;like video pitu filler sdcc fan mail unbox 
positiv;like video sarah mertan con shark news gameofblogg sdcc 
negativ;may old wheelchair die make sdcc 
positiv;need 
positiv;realli need deadpool 
positiv;realli wan na go sdcc one year man 
neutral;swear totino boat sdcc 
positiv;wan na go meet bad 
positiv;want o_o 
negativ;would give much sdcc 
neutral;codi rock sdcc codyposey photo dont happen what fuck point lad 
positiv;someon want take sdcc thatd great 
neutral;ill say im like free event favorit show sdcc hope new thing ftwd wynonnaearp 
neutral;ill never forget got make dessert amp still work supernatur fangirl sdcc 
negativ;im actual gon na make sure schedul clear plan ahead go sdcc next year 
negativ;im cri 
neutral;im sad shelley dylan wont sdcc without 
neutral;im excit sdcc 
positiv;cant get better fall asleep hammock san diego sky listen sdcc hammocklif epicholiday 
negativ;call day go bed hope get sdcc exclus want tomorrow 
neutral;wonder sdcc weekend everyon comic con im bitter sit home 
neutral;fight centuri battl kick conancon sdcc via 
neutral;juli comic con sdcc th year press 
neutral;kick sdcc 
neutral;marvel comic sdcc hasbro exclus marvel legend raft sandman new loos figur end d ebay us 
neutral;mcu releas offici panel amp sign schedul chadwickboseman sdcc marvelsdcc blackpanth sdcc 
neutral;sdcc pn go bed even less sleep tomorrow day good night 
positiv;bodi readi 
neutral;sdcc cosplay lineup sdcc sdcc cosplay 
neutral;news holland tyler p dylan codi khylin e jeff davi sono arrivati san diego sdcc 
positiv;ngl everi year im excit nerd hq actual sdcc content qualiti much better 
neutral;noodl amp santana wonder im sdcc cuz im australia teleport dont exist 
negativ;odin give strength vike viper den sdcc vikingssdcc sweepstak 
neutral;oh god 
positiv;ok need 
neutral;pinback bobbl funko pop sdcc suicid squad underwat batman summer convent store mall 
neutral;pleas 
neutral;power ranger comiccon expect via sdcc powerrang 
neutral;pssst your go sdcc get coffe lobbi ill better 
negativ;realli sad shelley go sdcc 
positiv;sandiego becom mini hollywood celebr roam fan cosplay everywher sdcc wish tix 
neutral;sdcc marvel promo antman movi x poster comic con exclus nm 
neutral;sdcc beast kingdom egg attack exclus golden star war sandtroop starwar 
neutral;sdcc exclus hasbro magic gather zombi planeswalk card set 
neutral;sdcc exclus sanrio hello kitti upper deck bundl pack link bio 
neutral;sdcc rogu one star war stori costum display lucasfilm b via 
neutral;sdcc hasbro exclus star war black seri obi wan kenobi figur sdcc 
neutral;sdcc sdcctrade justic leagu supergirl trade suicid squ 
neutral;sdcc star war sdcc kylo ren comic con exclus black seri 
neutral;sdcc start today im readi 
neutral;sdcc start tomorrow im nut 
neutral;sdcc full swing check us tomorrow updat 
neutral;sdcc preview coverag here better shot joker batsuit hottoy sdcc sdcc 
neutral;sdcc preview coverag suicid squad hot toy figur look hot hottoy sdcc sdcc 
neutral;shana went sdcc without 
neutral;shut take money 
positiv;basic yall want anyth sdcc includ mac make lem know ampyoul pay back give ya 
positiv;cool meet peopl real world way better pokemongo hope catch sdcc 
neutral;jealous peopl sdcc right got get shockmast figur 
neutral;mani beauti ppl one gif 
neutral;sdcc one night exhaust 
neutral;announc kotobukiya figur sdcc 
neutral;star war meisho teppou ashigaru sandtroop sdcc exclus limit hand starwar 
neutral;star war sdcc kylo ren comic con exclus black seri 
neutral;super excit sdcc amp grate get see amp look forward panel sgu 
neutral;take moneyyyyy fuuuckkkk assss grayson im lovin alreadi 
neutral;take late night stroll around gaslamp find guy float pokestop love sdcc 
neutral;teenag wouldv worn shit 
neutral;tfw gerard gon na sdcc llllllllool kms 
positiv;thank great event gameofblogg definit kick sdcc pic w 
negativ;thank bring gameofblogg back sdcc anoth round fun 
neutral;fact sdcc weekend someth never get 
neutral;green power ranger appear powerrangersmovi powerrang sdcc 
negativ;harley one precious 
neutral;latest aia entertain daili thank sdcc rncincl 
neutral;latest tequila tech rncincl sdcc 
neutral;latest steve o daili thank rncincl sdcc 
positiv;latest ted daili news thank dcsdcc sdcc 
positiv;latest uncl pappi wolf daili thank sdcc sdcc 
neutral;latest wait action comic comicbookresourc sdcc 
neutral;negan line display sdcc incred holi shit 
neutral;injustic charact reveal sdcc thrill 
neutral;insid album cover genius 
neutral;start sdcc 
positiv;time last year sdcc hall walkthrough amp tour 
neutral;weekend admin bring fastest sdcc updat follow page turn notif 
neutral;time sdccnerd hq depress 
negativ;celebr sdcc throwbackthursday rachel attend convent sherlockholm 
neutral;tom sdcc wont u see what wrong 
neutral;tonight ade went jog pokemon hunt around comiccon sdcc 
neutral;top anticip trailer sdcc movi 
neutral;tori mell roddenberri give zenni star trek th pin sdcc 
positiv;tri time buy funko exclus barn nobl work go back bed sdcc 
neutral;tsum tsum disney star war han solo greedo sdcc exclus comic con 
neutral;unfortun shes think shes film new film im sure 
neutral;vike got lot happen year sdcc make sure visit booth attend panel sign 
positiv;walk beat sdcc storiespart there even fun outsid 
neutral;walkingdead walk dead color negan amp glen pak sdcc hand tv seri 
negativ;watch periscop sdcc startrekbeyondpremier 
neutral;give limit edit shadow link figur sdcc juli amp follow detail giveaway locat 
neutral;welcom boat dipshit feralaudio sdcc totinospizzarol 
neutral;wear sdcc pleas help 
neutral;sdcc almost got ta jet texa famili vacat friday 
positiv;sdcc like min home min still min firstworldproblem iwishihadticketsandtim 
negativ;worst sdcc ever 
positiv;ya never know youll run morn san diego comiccon sdcc 
negativ;yalc next week sdcc weekend im go neither 
neutral;year ago discov dear friend terribl sleep apnea never thought im reliv nightmar sdcc 
neutral;yep im type person wake buy newli releas exclus sdcc funko pop onlin 
neutral;play hester two face screamqueen sdcc 
neutral;could play anoth charact show would sdcc screamqueen 
neutral;like sdcc coveragenic job 
negativ;sure believ lmao 
positiv;cool fuck teaser cool go sdcc 
neutral;go sdcc tomorrow saturday ok 
neutral;someth introduc sdcc sure short teaser imho 
neutral;smash park sdcc 
positiv;look brilliant enjoy sdcc would love 
neutral;moffat talk sdcc 
neutral;number confirm offer everi singl sdcc exclus custom 
positiv;thank sdcc therapi even 
neutral;thing ill post everyon alreadi sdcc icon lol 
negativ;thedefend sdcc teaser 
neutral;somewher trailer sdcc cant check bc im home 
neutral;kenni 
neutral;ad sdcc pop vinyl websit today 
neutral;look like sue storm drawn jae lee sdcc hilton san diego bayfront 
neutral;inquisitrsdcc walk dead fan get close person season final 
negativ;sigh one day 
neutral;rock sdcc fxsdcc vr 
negativ;sdcc dead rise handson 
neutral;sdcc iron fist un tout sdcc netflix marvel ironfist 
neutral;great photo sdcc 
neutral;jmo hot sdcc 
neutral;lot selfi cast sdcc 
neutral;morrilla selfi sdcc 
neutral;ft bronz captain america statu unveil sdcc 
neutral;day go sdcc ninjago 
neutral;master paint master sdcc 
positiv;thing beauti 
positiv;go star war celebr last weekend realli want go comic con san diego one day swce sdcc 
neutral;bae sdcc margot emili kill 
positiv;alright go sdcc tomorrow im go lot stuff anyon want said stuff poster sticker etc riverdal 
neutral;also know worst thing sdcc miss info news alway last know 
negativ;lil pup emot speech priceless realli alyciadebnamcarey sdcc 
neutral;trailer arrow year sdcc 
neutral;andi lincoln chandler rigg plane sdcc thewalkingdead chandlerrigg andrewlincoln 
neutral;anthoni u watch cast 
neutral;recommend et 
neutral;arghhhhh sdcc trailer alreadi 
neutral;ashley eckstein lego dress univers sdcc vlogger 
neutral;ashley eckstein interview univers comic con sdcc oaknew 
positiv;lastsom good news daredevilseason 
positiv;aw man broke 
neutral;bluefin debut exclus sdcc collect 
neutral;brand new teaser lukecag amp straight sdcc 
positiv;someon get christma 
neutral;pleas photo sdcc togeth die happili 
neutral;cancel show pls 
positiv;cant wait hype sdcc start 
negativ;check full size walk dead charact creat amaz team artist knb efx 
neutral;comic con parti sdcc nathanfillion conman 
neutral;comic con repres america better gop sdcc oaknew 
neutral;comic con new robot war wwe battleground gon na good week sdcc robotwar battleground 
neutral;didnt like previous season hope like one happi end like show 
neutral;emma loggin jenn steel sdcc oaknew 
neutral;epic song accompani marvel defend sdcc teaser netflix hd via nirvana comeasyouar 
positiv;everi year proclaim next year shall attend sdcc nope nope 
positiv;excit sdcc news come 
positiv;justin timberlak hot dad let us fill first day sdcc 
neutral;funko pop sdcc marvel collector corp hobgoblin year one box exclus 
neutral;game throne john bradley teas what come oldtown sdcc john bradley stop talk abou 
neutral;gear war sdcc gameplay microsofton news pcesteam gearsofwar 
neutral;groovi marvel luke cage sdcc teaser netflix hd via 
neutral;vote delena yet 
neutral;babi 
neutral;hey your wonder librari sd gon na central librari next petco park sdcc 
negativ;hype nycc got real wildstorm fan thank sdcc reveal hope wildstormreborn pan takemymoney 
neutral;ad video playlist marvel defend sdcc teaser trailer song extend hd 
positiv;excit rn 
neutral;gain free follow huddersfield sdcc robmanfr 
neutral;got break danc floor ice omnia peopl thought secur block floor fals im invis sdcc 
positiv;hope bob post selfi sdcc 
positiv;hope king post pre sdcc selfi 
neutral;like video man high castl world expand season sdcc 
neutral;like video marvel iron fist sdcc first look netflix hd 
neutral;like video marvel luke cage sdcc teaser netflix hd 
neutral;like video marvel defend sdcc teaser netflix hd 
positiv;like video marvel defend sdcc teaser netflix nederland 
positiv;like video talk spiderman ps luke cage marvel movi agent m sdcc 
positiv;like video voltron creator went big twist sdcc 
positiv;like video marvel defend sdcc teaser netflix reaction sdcc 
neutral;like video sdcc south park interact offsit experi nsfw 
positiv;need thisssss 
neutral;panel programma per oggi sono bone game throne agent shield e screem queen sdcc 
positiv;wish sdcc 
positiv;wish sdcc 
neutral;icymi today hope amaz time sdcc 
positiv;im excit backer project 
negativ;im gon na watch yet dont want cri 
negativ;im okay im cri 
neutral;im readi die 
negativ;im damn exit figur idea 
positiv;insid parti crowd usual throw one best parti sdcc ignbash gtgt 
positiv;ironfist daredevilseason teenwolfseason lukecag cant wait moreeeee sdcc 
positiv;bob gon na post pre sdcc selfi hope 
neutral;movi fight go view askewnivers theme amp call moobi fight screenjunkiescentr sdcc 
neutral;time year trailer news tv show movi everywher california sdcc 
neutral;joe quesada luke cage embrac nyc iron fist villain count sdcc marvel cco joe quesada talk 
neutral;juli nd sdcc aaron webber walk stage audienc goe wild aaron inhal big fish adventur auditorium explod 
neutral;see sdcc make tear 
neutral;see sdcc make tear 
neutral;last minut sdcc pack apt tune 
positiv;love happi birthday ryu way 
neutral;loveloveloveeeeeeee 
negativ;make sure catch thetitanmovi gameofthron sdcc 
positiv;marvel kill sdcc everi year weve learn celebr accept dc fan like take grain salt 
neutral;marvel releas new defend logo via 
neutral;marvel iron fist sdcc first look netflix 
neutral;marvel luke cage sdcc teaser netflix hd via 
neutral;marvel defend sdcc teaser netflix hd 
neutral;marvelsdcc unveil first trailer upcom defend seri check sdcc 
negativ;mcthorit feel get nugget kick next day 
neutral;moana open scene costum worn dwayn johnson maui address sdcc 
positiv;model walk univers runway comic con sdcc oaknew 
neutral;monster high sdcc preview night 
neutral;figur come year sdcc 
positiv;must watch hero movi 
neutral;brother whos normal dead asleep sleep sdcc twd trailer hype hes go week 
positiv;dream go sdcc one year wishiwasther 
positiv;idol godess proud 
positiv;love 
neutral;netflix marvel perfect sdcc 
neutral;nice cape action starwar sdcc sdcc costumedesign rogueon comiccon geekeri 
negativ;oh shit oh shit oh shit 
neutral;olic sdcc happen friday juli nd 
neutral;ship tous 
negativ;girl line bone final sdcc panel catch final bonesfarewel serious busi 
neutral;pinback bobbl funko pop sdcc teen titan starfir flash robin batman wonder woman set store mall 
neutral;pleas find onlin shop sell doctor strang funko pop worldwid let know sdcc doctorstrang 
neutral;pokemongo downtown sdcc 
neutral;portia doubleday au comiccon sdcc 
positiv;pre sdcc selfi els 
negativ;quick word warn gon na lot sdcc post page fangirl overload immin 
negativ;reinhardt servic 
neutral;ride lax temecula morn sure may well head sdcc sinc im close 
positiv;right feel 
neutral;sdcc sleep cycl dictat batteri charg cycl 
neutral;sdcc netflix et marvel montrent luke cage iron fist et defend 
neutral;sdcc mattel ever high cedar wood doll presal mattel via sdcc everafterhigh sdcc sdcc 
neutral;sdcc first teaser marvel iron fist 
neutral;sdcc arnett present live comiccon 
positiv;sdcc day watch fatmanonbatman drink w minim w nocsdcc 
negativ;sdcc bless 
neutral;sdcc tomorrow awak twitter 
neutral;sdcc last year tho 
positiv;sdcc photo cbs fan favorit ncis criminalmind ncisla zoo criminalmindsbeyondbord 
neutral;sdcc video man high castl season trailer amp clip themaninthehighcastl sdcc 
neutral;sdcc justic leagu action highlight reel debut first footag anim seri comic book resourc 
neutral;sdcc icon collid wonder womanbion woman crossov 
neutral;sdcc new red band trailer adult anim comedi sausag parti 
neutral;sdcc telltal thewalkingdead season screenshot emerg 
neutral;sdcc walk dead fan get close person season final negan scene amc twd stall video 
neutral;sdcc sleepingsitu lol men one woman sleep comiccon thetravelingnerd godhatesgeek 
neutral;snowden sdcc trailer 
neutral;sostarbuck line shortest line go figur sdcc aka linecon 
neutral;spockin sdcc pict livelongandprosp spock startrek leonardnimoy generoddenberri 
neutral;spoiler ahoy 
neutral;starwar rd sdcc exclus star war black seri obiwan kenobi hand readi ship theforceawaken 
neutral;starwar rd lego star war polybag awe pilot rebel new bag mint condit sdcc theforceawaken 
neutral;steven moffat said exact word sdcc imnotokay 
neutral;stone snowden get sdcc trailer via 
neutral;street fighter v chun li 
neutral;sweden new aquaman sketch collect friend sdcc 
negativ;tag urself im right nike sandal floor 
neutral;tardi wormhol dress univers sdcc oaknew 
positiv;thank fuckin god final focus femal heroin 
positiv;thank y ou god 
positiv;made cri beauti 
neutral;that 
neutral;that boy 
negativ;th pic tho look like bitch u kirkman said die one safe 
neutral;cast goof around hbo cinemax parti sdcc 
neutral;cast luke cage sdcc 
neutral;latest read thank rncincl sdcc 
neutral;latest steve oatway photographi daili ewcomiccon sdcc 
positiv;trio would behind front top underneath theyr hot gfi 
positiv;seem realli interest 
neutral;seri amaz im glad part generat legitcryinrn wynonnaearp sdcc 
neutral;peopl sdcc meet robbi thompson pleas hug 
positiv;today day catch sdcc chanc sensi get sens fix 
neutral;toy au fun play flash gorilla grodd sdcc summer convent exclus pop v ebay deal buynow 
neutral;turtelici sdcc 
neutral;violett sdcc yes 
neutral;void stile back 
neutral;wait tormund iest pas mort 
neutral;watch marvel iron fist sdcc first look netflix hd youtub 
neutral;watch ironfist newest player tv univers sdcc 
neutral;watch ironfist newest player marvel tv univers sdcc 
positiv;know crowd push get free stuff today small press n sdcc sdcc getnit 
negativ;may parti hard tonight refuel dope mexican food fueltheparti sdcc 
neutral;hell stile lol 
negativ;skyeward banner aw 
neutral;spent day refresh youtub wait new sdcc vid 
neutral;when dcs sdcc panel 
positiv;pic thewalkingdead 
neutral;tho 
positiv;wish sdcc 
neutral;woman walk sdcc ballroom line loud said employe could take time wouldnt fuck employe 
neutral;yeah might get ad cosplay list 
neutral;heard sdcc confirmdeni 
neutral;know get real even homeless guy talk sdcc 
neutral;yesss normanreedus jeffreydeanmorgan sdcc 
negativ;season slow place see work hope didnt lose audienc 
neutral;pay lego comicconinword ftw point sdcc funnythingskidssay 
neutral;gotham sdcc camren saw selina background bridgetivi relationship see in 
neutral;gotham sdcc what bruce ampselina event ampa charact g forward 
positiv;im pro photog love luciferamp would love get pic sdcc servic dog chanc 
neutral;sdcc rad year 
neutral;lauren give scoop comic con sdcc 
neutral;go breakdown walk dead season sdcc trailer thewalkingdead sdcc 
neutral;see sdcc season rampm clip 
negativ;think might happen true 
neutral;fay look complet differ everi photo seen sdcc bare recognis x 
neutral;hahahahahahah im stage sdcc 
positiv;feel like u would appreci 
neutral;feel hon moment vike thing make happi sdcc 
negativ;take your sdcc littl far 
positiv;think wish sdcc 
negativ;case havent seen 
neutral;sdcc start shatter yesterday teen wolf announc final season ive review show year 
positiv;sdcc justiceleaguemovi done w love 
positiv;someon beaten xx 
neutral;perfect bring charact life static figur talk interact 
neutral;im part hahahahahahahaha bes 
neutral;felt need kill ward lincoln kid ask real question agentsofshield sdcc 
neutral;oliv fangirl moment 
neutral;hold downtown san diego teamvalor let go pokemongo sdcc sdcc 
neutral;miniladdd hold downtown san diego teamvalor let go pokemongo sdcc sdcc 
neutral;day life sdcc thursday teen wolf tear moffat muse 
positiv;line proper manag would good start 
positiv;aaaah love iwan 
positiv;anoth syfi comic con parti done sdcc hotel solamar kimpton hotel 
negativ;anyon get wristband tweet get one next year panel hey group hallh hallhlin sdcc 
negativ;capac sad 
neutral;benedict cumberbatch sdcc earlier hope time hell broke loos itsonlythebegin 
neutral;pic brief time sdcc earper couldnt 
neutral;comic con master post photo amp video mq photo updat hq new portrait chloebennet sdcc 
neutral;comic con san diego friday dusk sdcc via 
neutral;could interest 
neutral;daaaaamn 
neutral;day two sdcc cri 
neutral;didnt hear word eliza said caus focus lindsey 
neutral;emmi nomin beauti birthday bash sdcc good time cumberclan 
negativ;enni dastard muttley dont know 
negativ;everyon go read like 
neutral;explain 
positiv;gear war sdcc panel talk jds full name hord mode hint gear movi 
neutral;go insid game throne epic wall face sdcc got 
negativ;goal life attend sdcc doctorwho wynonnaearp starwar sherlock there much 
positiv;goodnight love chandler much take look u get chanc kinda import 
positiv;heaven real 
neutral;shoulder make believ god 
positiv;hes alway nice 
positiv;hes sweet person 
negativ;holi fuck 
neutral;would improv comiccon rave throne parti 
positiv;manag cant imagin 
neutral;hq photo billi pose comiccon carpet sdcc screamqueen 
positiv;cant wait origin one time favorit horror genr sdcc blairwitch 
negativ;couldnt help sdcc 
negativ;didnt know william regal wore tiara back day 
negativ;dont wan na go work today wan na stay freak sdcc 
negativ;miss much sleep ugh hate sdcc 
neutral;pm everyth today includ buy new bag spain descend sdcc hell 
positiv;like video marvel defend sdcc teaser reaction 
neutral;like video biggest thing sdcc liter ign access 
neutral;love famili sdcc sdcc 
positiv;love 
neutral;need work paper uni sdcc anxieti 
neutral;id rather comic con sdcc 
neutral;idlikeitmoreif mental physic comic con sdcc 
neutral;anyon link watch preacher sdcc panel pls help id high appreci 
neutral;puberti hit chandler hard hit 
neutral;dont think best glow ever im su 
negativ;got go sdcc amp met gabriel ba amp fabio moon hate 
neutral;time crafti person super soooo would cosplay m sdcc aldubsuperma 
neutral;im go die httpstcolybkxw 
negativ;im jump cliff 
neutral;im literallt rhe mo cat rn 
negativ;im readi 
neutral;sdcc signific quiet year havent heard seen much compar previous year 
positiv;ive awak min sdcc alreadi kill cool 
neutral;izombi season scoop sdcc comic izombi crew oper togeth scoobi gang 
neutral;kotobukiya bishoujo marvel thor new imag sdcc kotobukiya marvel ladi thor bishoujo 
neutral;land untold stori omfg ajshdjsidhdjcksidhsjxjsj 
neutral;las vega yearsofonedirect dncleak sdcc usabmnt rncincl blair witch sonic ruca 
neutral;lindsey dork backgroud stan 
neutral;lindsey steal show lol 
negativ;lmao hes gon na shoot place 
neutral;lmfao 
neutral;look walk around gaslamp area oliverqueen arrow sdcc steveamelli 
neutral;marvel host panel hall h today juli pm pm local time doctorstrang expect featur sdcc 
neutral;marvel agent shield season teaser sdcc agenstofshield season marvel ghostrid 
neutral;mattel cli sdcc ghostbust courtroom battl egon spengler 
positiv;much dont give singl f whatev cast writer except cmd rv 
neutral;likey 
positiv;rememb im sdcc 
neutral;trailer arrow year sdcc 
positiv;take lagertha 
neutral;new photo billi panel screamqueen sdcc comiccon 
neutral;mute watch lindsey im proud stan 
positiv;bodi readi 
neutral;friend triniti dress cosplay sdcc kuroku 
negativ;heart 
positiv;sweet son 
neutral;top pokemongo im readi sdcc tomorrow teamvalor 
neutral;twitter divid celebr sdcc mourn munich 
neutral;new photo teen wolf cast san diego sdcc gtgt 
neutral;new photo billi comiccon sdcc screamqueen 
neutral;new photo billi panel screamqueen sdcc comiccon 
neutral;new portrait chloebennet sdcc agentsofshield ao 
positiv;nice 
neutral;noth confirm fan spot rachel amp san diego let hope mean attend sdcc today 
neutral;nw steven univers panel sdcc 
neutral;sdcc yeter 
positiv;oh wish san diego right sdcc comiccon bucketlist 
neutral;oh god 
positiv;okay got even interest even sound littl gimmicki 
neutral;omg lindsey 
neutral;play bit splatfest tonight come home day sdcc got defend rank dcs got frequent 
neutral;pleas post anybodi see pictur boy today ill work sdcc comiccon 
neutral;repost tough day work sdcc 
neutral;sdcc disney pop funko went littl crazi bought 
neutral;sdcc limit edit funko pop deadpool cowboy deadpool thumb lot 
neutral;sdcc hasbro star war black kylo ren unmask sdcc exclus action figur set 
neutral;sdcc go give pain see 
neutral;sdcc marvel starwar blackseri new imag star war black seri line includ tusken raider lando 
neutral;sdcc saga alana amp marko san diego comicon sdcc exclus figur mcfarlan toy 
negativ;sdcc supergirl panel today pleas let good news whisper calista 
neutral;sdcc arrow colton hayn head scream queen via news break 
neutral;sdcc walk dead season seven trailer unleash via news break 
neutral;sdcc watch first trailer american god 
neutral;sdcc film announc bring godzillaresurg us cinema late freakingneat 
neutral;sdcc black sail zach mcgowan join full time season gamedev 
positiv;second half season look great cant wait 
negativ;said shit 
negativ;shes pretti cri 
neutral;sneak peak costum baron mordo dr strang ancient one doctor strang sdcc drstrang 
neutral;sdcc glad dont stan problemat white girl idk octagon clark 
negativ;batman slept batgirl thekillingjok what next catwoman get fridg without feel thing organ sdcc 
negativ;much marvel news sdcc cant sleep anymor case miss someth 
positiv;readi 
neutral;sophi turner nathali emmanuel sdcc lt 
neutral;star war sdcc kylo ren comic con exclus black seri hasbro new 
neutral;starz releas first trailer american god watch 
positiv;that funniest thing ive ever seen deceas 
neutral;biggest thing sdcc liter ign access watch 
neutral;hallhlin line choos stay amp go gon na long hour till warnerbro panel sdcc 
neutral;latest onepercentofon daili thank sdcc sdcc 
neutral;latest pearl jewelleri onlin rncincl sdcc 
neutral;latest tequila tech sdcc darktowermovi 
positiv;latest clean sutton daili thank sdcc munich 
neutral;latest freeman ssfootbal sdcc 
positiv;latest gorilla pete daili thank sfgiant sdcc 
positiv;latest hornybabesex daili thank adult sdcc 
positiv;latest museummedia daili thank edwardhopp sdcc 
neutral;latest regular steve enquir thank munich sdcc 
neutral;latest ted daili news sdcc ewcomiccon 
positiv;latest uncl pappi wolf daili thank sdcc sdcc 
neutral;latest yellowpin daili sdcc axeljob 
positiv;latest thecraftbeerselfi thank craftbeer sdcc 
neutral;latest tomorrow technolog sdcc sdcc 
positiv;latest workplacefutur tech bulletin thank sdcc sdcc 
neutral;three amigo way sdcc credit ig colinodonoghu holytrin 
neutral;thekillingjok awesom amaz see childhood legend sdcc 
